19:52:12.619333 IP dev.akcl-1.b4.ext.1092 > dev.akcl-1.b1.int.49413: Flags [S.], seq 2436289096, ack 157854404, win 65160, options [mss 1460,sackOK,TS val 4116292898 ecr 2055391802,nop,wscale 7], length 0
19:52:12.619504 IP dev.akcl-1.b4.ext.1092 > dev.akcl-1.b1.int.49413: Flags [.], ack 287, win 507, options [nop,nop,TS val 4116292898 ecr 2055391802], length 0
19:52:12.619568 IP dev.akcl-1.b4.ext.1092 > dev.akcl-1.b1.int.49413: Flags [P.], seq 1:373, ack 287, win 507, options [nop,nop,TS val 4116292898 ecr 2055391802], length 372
19:52:12.769920 IP dev.akcl-1.b4.ext.1092 > dev.akcl-1.b1.int.49413: Flags [P.], seq 373:812, ack 573, win 505, options [nop,nop,TS val 4116293048 ecr 2055391952], length 439
19:52:12.920355 IP dev.akcl-1.b4.ext.1092 > dev.akcl-1.b1.int.49413: Flags [P.], seq 812:1251, ack 859, win 503, options [nop,nop,TS val 4116293199 ecr 2055392103], length 439
19:52:12.942183 IP dev.akcl-1.b4.ext.1092 > dev.akcl-1.b1.int.49413: Flags [P.], seq 1251:1364, ack 1449, win 499, options [nop,nop,TS val 4116293221 ecr 2055392103], length 113
19:52:12.962881 IP dev.akcl-1.b4.ext.1092 > dev.akcl-1.b1.int.49413: Flags [P.], seq 1364:1477, ack 1846, win 496, options [nop,nop,TS val 4116293241 ecr 2055392125], length 113
19:52:13.026176 IP dev.akcl-1.b4.ext.1092 > dev.akcl-1.b1.int.49413: Flags [P.], seq 1477:1590, ack 2311, win 493, options [nop,nop,TS val 4116293305 ecr 2055392188], length 113
19:52:13.068347 IP dev.akcl-1.b4.ext.1092 > dev.akcl-1.b1.int.49413: Flags [P.], seq 1590:1703, ack 2776, win 490, options [nop,nop,TS val 4116293347 ecr 2055392230], length 113
19:52:13.114093 IP dev.akcl-1.b4.ext.1092 > dev.akcl-1.b1.int.49413: Flags [P.], seq 1703:1816, ack 3104, win 488, options [nop,nop,TS val 4116293393 ecr 2055392272], length 113
19:52:13.370771 IP dev.akcl-1.b4.ext.1092 > dev.akcl-1.b1.int.49413: Flags [P.], seq 1816:2255, ack 3390, win 486, options [nop,nop,TS val 4116293649 ecr 2055392553], length 439
19:52:13.521023 IP dev.akcl-1.b4.ext.1092 > dev.akcl-1.b1.int.49413: Flags [P.], seq 2255:2627, ack 3606, win 485, options [nop,nop,TS val 4116293800 ecr 2055392704], length 372
19:52:13.671422 IP dev.akcl-1.b4.ext.1092 > dev.akcl-1.b1.int.49413: Flags [P.], seq 2627:2999, ack 3822, win 484, options [nop,nop,TS val 4116293950 ecr 2055392854], length 372
19:52:13.821653 IP dev.akcl-1.b4.ext.1092 > dev.akcl-1.b1.int.49413: Flags [P.], seq 2999:3371, ack 4038, win 483, options [nop,nop,TS val 4116294100 ecr 2055393004], length 372
19:52:13.971902 IP dev.akcl-1.b4.ext.1092 > dev.akcl-1.b1.int.49413: Flags [P.], seq 3371:3743, ack 4254, win 482, options [nop,nop,TS val 4116294250 ecr 2055393155], length 372
19:52:14.122168 IP dev.akcl-1.b4.ext.1092 > dev.akcl-1.b1.int.49413: Flags [P.], seq 3743:4115, ack 4470, win 481, options [nop,nop,TS val 4116294401 ecr 2055393305], length 372
19:52:14.272844 IP dev.akcl-1.b4.ext.1092 > dev.akcl-1.b1.int.49413: Flags [P.], seq 4115:4487, ack 4686, win 480, options [nop,nop,TS val 4116294551 ecr 2055393455], length 372
19:52:14.423235 IP dev.akcl-1.b4.ext.1092 > dev.akcl-1.b1.int.49413: Flags [P.], seq 4487:4859, ack 4902, win 479, options [nop,nop,TS val 4116294702 ecr 2055393606], length 372
19:52:14.573633 IP dev.akcl-1.b4.ext.1092 > dev.akcl-1.b1.int.49413: Flags [P.], seq 4859:5231, ack 5118, win 478, options [nop,nop,TS val 4116294852 ecr 2055393756], length 372
19:52:14.724137 IP dev.akcl-1.b4.ext.1092 > dev.akcl-1.b1.int.49413: Flags [P.], seq 5231:5603, ack 5334, win 477, options [nop,nop,TS val 4116295003 ecr 2055393907], length 372
19:52:14.845507 IP dev.akcl-1.b4.ext.1092 > dev.akcl-1.b1.int.49413: Flags [P.], seq 5603:5716, ack 5469, win 476, options [nop,nop,TS val 4116295124 ecr 2055394028], length 113
19:52:15.024554 IP dev.akcl-1.b4.ext.1092 > dev.akcl-1.b1.int.49413: Flags [P.], seq 5716:6088, ack 5685, win 475, options [nop,nop,TS val 4116295303 ecr 2055394207], length 372
19:52:15.175178 IP dev.akcl-1.b4.ext.1092 > dev.akcl-1.b1.int.49413: Flags [P.], seq 6088:6460, ack 5901, win 474, options [nop,nop,TS val 4116295454 ecr 2055394358], length 372
19:52:15.260452 IP dev.akcl-1.b4.ext.1092 > dev.akcl-1.b1.int.49413: Flags [P.], seq 6460:6573, ack 7169, win 524, options [nop,nop,TS val 4116295539 ecr 2055394443], length 113
19:52:15.261219 IP dev.akcl-1.b4.ext.1092 > dev.akcl-1.b1.int.49413: Flags [P.], seq 6573:6686, ack 8437, win 546, options [nop,nop,TS val 4116295540 ecr 2055394443], length 113
19:52:15.263560 IP dev.akcl-1.b4.ext.1092 > dev.akcl-1.b1.int.49413: Flags [.], ack 15677, win 659, options [nop,nop,TS val 4116295542 ecr 2055394446], length 0
19:52:15.263594 IP dev.akcl-1.b4.ext.1092 > dev.akcl-1.b1.int.49413: Flags [.], ack 22101, win 646, options [nop,nop,TS val 4116295542 ecr 2055394446], length 0
19:52:15.263849 IP dev.akcl-1.b4.ext.1092 > dev.akcl-1.b1.int.49413: Flags [P.], seq 6686:6799, ack 22101, win 659, options [nop,nop,TS val 4116295542 ecr 2055394446], length 113
19:52:15.265287 IP dev.akcl-1.b4.ext.1092 > dev.akcl-1.b1.int.49413: Flags [.], ack 34732, win 654, options [nop,nop,TS val 4116295544 ecr 2055394448], length 0
19:52:15.265397 IP dev.akcl-1.b4.ext.1092 > dev.akcl-1.b1.int.49413: Flags [.], ack 48396, win 659, options [nop,nop,TS val 4116295544 ecr 2055394448], length 0
19:52:15.265433 IP dev.akcl-1.b4.ext.1092 > dev.akcl-1.b1.int.49413: Flags [P.], seq 6799:6912, ack 48396, win 659, options [nop,nop,TS val 4116295544 ecr 2055394448], length 113
19:52:15.265693 IP dev.akcl-1.b4.ext.1092 > dev.akcl-1.b1.int.49413: Flags [P.], seq 6912:7025, ack 48396, win 659, options [nop,nop,TS val 4116295544 ecr 2055394448], length 113
19:52:15.269205 IP dev.akcl-1.b4.ext.1092 > dev.akcl-1.b1.int.49413: Flags [.], ack 66192, win 659, options [nop,nop,TS val 4116295548 ecr 2055394452], length 0
19:52:15.269589 IP dev.akcl-1.b4.ext.1092 > dev.akcl-1.b1.int.49413: Flags [P.], seq 7025:7138, ack 66192, win 659, options [nop,nop,TS val 4116295548 ecr 2055394452], length 113
19:52:15.269598 IP dev.akcl-1.b4.ext.1092 > dev.akcl-1.b1.int.49413: Flags [.], ack 82955, win 921, options [nop,nop,TS val 4116295548 ecr 2055394452], length 0
19:52:15.269741 IP dev.akcl-1.b4.ext.1092 > dev.akcl-1.b1.int.49413: Flags [P.], seq 7138:7251, ack 82955, win 921, options [nop,nop,TS val 4116295548 ecr 2055394452], length 113
19:52:15.269928 IP dev.akcl-1.b4.ext.1092 > dev.akcl-1.b1.int.49413: Flags [.], ack 101784, win 1216, options [nop,nop,TS val 4116295549 ecr 2055394453], length 0
19:52:15.270221 IP dev.akcl-1.b4.ext.1092 > dev.akcl-1.b1.int.49413: Flags [P.], seq 7251:7364, ack 101784, win 1216, options [nop,nop,TS val 4116295549 ecr 2055394453], length 113
19:52:15.275489 IP dev.akcl-1.b4.ext.1092 > dev.akcl-1.b1.int.49413: Flags [.], ack 129296, win 1645, options [nop,nop,TS val 4116295554 ecr 2055394458], length 0
19:52:15.275489 IP dev.akcl-1.b4.ext.1092 > dev.akcl-1.b1.int.49413: Flags [.], ack 140240, win 1816, options [nop,nop,TS val 4116295554 ecr 2055394458], length 0
19:52:15.276119 IP dev.akcl-1.b4.ext.1092 > dev.akcl-1.b1.int.49413: Flags [P.], seq 7364:7477, ack 140240, win 1816, options [nop,nop,TS val 4116295555 ecr 2055394458], length 113
19:52:15.277266 IP dev.akcl-1.b4.ext.1092 > dev.akcl-1.b1.int.49413: Flags [.], ack 169399, win 2272, options [nop,nop,TS val 4116295556 ecr 2055394460], length 0
19:52:15.277594 IP dev.akcl-1.b4.ext.1092 > dev.akcl-1.b1.int.49413: Flags [P.], seq 7477:7590, ack 169399, win 2272, options [nop,nop,TS val 4116295556 ecr 2055394460], length 113
19:52:15.282210 IP dev.akcl-1.b4.ext.1092 > dev.akcl-1.b1.int.49413: Flags [.], ack 211391, win 2928, options [nop,nop,TS val 4116295561 ecr 2055394465], length 0
19:52:15.282250 IP dev.akcl-1.b4.ext.1092 > dev.akcl-1.b1.int.49413: Flags [.], ack 234713, win 3293, options [nop,nop,TS val 4116295561 ecr 2055394465], length 0
19:52:15.282885 IP dev.akcl-1.b4.ext.1092 > dev.akcl-1.b1.int.49413: Flags [P.], seq 7590:7703, ack 234713, win 3293, options [nop,nop,TS val 4116295561 ecr 2055394465], length 113
19:52:15.285510 IP dev.akcl-1.b4.ext.1092 > dev.akcl-1.b1.int.49413: Flags [.], ack 276705, win 3949, options [nop,nop,TS val 4116295564 ecr 2055394468], length 0
19:52:15.285510 IP dev.akcl-1.b4.ext.1092 > dev.akcl-1.b1.int.49413: Flags [.], ack 282466, win 4039, options [nop,nop,TS val 4116295564 ecr 2055394468], length 0
19:52:15.285740 IP dev.akcl-1.b4.ext.1092 > dev.akcl-1.b1.int.49413: Flags [P.], seq 7703:7816, ack 282466, win 4039, options [nop,nop,TS val 4116295564 ecr 2055394468], length 113
19:52:15.291854 IP dev.akcl-1.b4.ext.1092 > dev.akcl-1.b1.int.49413: Flags [.], ack 344730, win 5012, options [nop,nop,TS val 4116295570 ecr 2055394474], length 0
19:52:15.291854 IP dev.akcl-1.b4.ext.1092 > dev.akcl-1.b1.int.49413: Flags [.], ack 391207, win 5738, options [nop,nop,TS val 4116295570 ecr 2055394474], length 0
19:52:15.292316 IP dev.akcl-1.b4.ext.1092 > dev.akcl-1.b1.int.49413: Flags [P.], seq 7816:7929, ack 391207, win 5738, options [nop,nop,TS val 4116295571 ecr 2055394474], length 113
19:52:15.299481 IP dev.akcl-1.b4.ext.1092 > dev.akcl-1.b1.int.49413: Flags [.], ack 456367, win 6377, options [nop,nop,TS val 4116295578 ecr 2055394482], length 0
19:52:15.299533 IP dev.akcl-1.b4.ext.1092 > dev.akcl-1.b1.int.49413: Flags [.], ack 479268, win 6377, options [nop,nop,TS val 4116295578 ecr 2055394482], length 0
19:52:15.299930 IP dev.akcl-1.b4.ext.1092 > dev.akcl-1.b1.int.49413: Flags [P.], seq 7929:8042, ack 479268, win 6377, options [nop,nop,TS val 4116295579 ecr 2055394482], length 113
19:52:15.309450 IP dev.akcl-1.b4.ext.1092 > dev.akcl-1.b1.int.49413: Flags [.], ack 544428, win 6377, options [nop,nop,TS val 4116295588 ecr 2055394492], length 0
19:52:15.309450 IP dev.akcl-1.b4.ext.1092 > dev.akcl-1.b1.int.49413: Flags [.], ack 609588, win 6377, options [nop,nop,TS val 4116295588 ecr 2055394492], length 0
19:52:15.309471 IP dev.akcl-1.b4.ext.1092 > dev.akcl-1.b1.int.49413: Flags [.], ack 674748, win 6377, options [nop,nop,TS val 4116295588 ecr 2055394492], length 0
19:52:15.309511 IP dev.akcl-1.b4.ext.1092 > dev.akcl-1.b1.int.49413: Flags [.], ack 698647, win 6507, options [nop,nop,TS val 4116295588 ecr 2055394492], length 0
19:52:15.309881 IP dev.akcl-1.b4.ext.1092 > dev.akcl-1.b1.int.49413: Flags [P.], seq 8042:8155, ack 698647, win 6507, options [nop,nop,TS val 4116295588 ecr 2055394492], length 113
19:52:15.324402 IP dev.akcl-1.b4.ext.1092 > dev.akcl-1.b1.int.49413: Flags [.], ack 763807, win 6507, options [nop,nop,TS val 4116295603 ecr 2055394507], length 0
19:52:15.324402 IP dev.akcl-1.b4.ext.1092 > dev.akcl-1.b1.int.49413: Flags [.], ack 828967, win 6611, options [nop,nop,TS val 4116295603 ecr 2055394507], length 0
19:52:15.324402 IP dev.akcl-1.b4.ext.1092 > dev.akcl-1.b1.int.49413: Flags [.], ack 894127, win 7111, options [nop,nop,TS val 4116295603 ecr 2055394507], length 0
19:52:15.324402 IP dev.akcl-1.b4.ext.1092 > dev.akcl-1.b1.int.49413: Flags [.], ack 959287, win 7111, options [nop,nop,TS val 4116295603 ecr 2055394507], length 0
19:52:15.324402 IP dev.akcl-1.b4.ext.1092 > dev.akcl-1.b1.int.49413: Flags [.], ack 977998, win 7403, options [nop,nop,TS val 4116295603 ecr 2055394507], length 0
19:52:15.324859 IP dev.akcl-1.b4.ext.1092 > dev.akcl-1.b1.int.49413: Flags [P.], seq 8155:8268, ack 977998, win 7403, options [nop,nop,TS val 4116295603 ecr 2055394507], length 113
19:52:15.325362 IP dev.akcl-1.b4.ext.1092 > dev.akcl-1.b1.int.49413: Flags [.], ack 1043158, win 7403, options [nop,nop,TS val 4116295604 ecr 2055394508], length 0
19:52:15.325362 IP dev.akcl-1.b4.ext.1092 > dev.akcl-1.b1.int.49413: Flags [.], ack 1108318, win 7403, options [nop,nop,TS val 4116295604 ecr 2055394508], length 0
19:52:15.325385 IP dev.akcl-1.b4.ext.1092 > dev.akcl-1.b1.int.49413: Flags [.], ack 1173478, win 7403, options [nop,nop,TS val 4116295604 ecr 2055394508], length 0
19:52:15.325385 IP dev.akcl-1.b4.ext.1092 > dev.akcl-1.b1.int.49413: Flags [.], ack 1238638, win 7403, options [nop,nop,TS val 4116295604 ecr 2055394508], length 0
19:52:15.325385 IP dev.akcl-1.b4.ext.1092 > dev.akcl-1.b1.int.49413: Flags [.], ack 1279182, win 7403, options [nop,nop,TS val 4116295604 ecr 2055394508], length 0
19:52:15.325385 IP dev.akcl-1.b4.ext.1092 > dev.akcl-1.b1.int.49413: Flags [.], ack 1339035, win 7403, options [nop,nop,TS val 4116295604 ecr 2055394508], length 0
19:52:15.325926 IP dev.akcl-1.b4.ext.1092 > dev.akcl-1.b1.int.49413: Flags [P.], seq 8268:8381, ack 1339035, win 7403, options [nop,nop,TS val 4116295605 ecr 2055394508], length 113
19:52:15.348742 IP dev.akcl-1.b4.ext.1092 > dev.akcl-1.b1.int.49413: Flags [.], ack 1404195, win 7403, options [nop,nop,TS val 4116295627 ecr 2055394531], length 0
19:52:15.348742 IP dev.akcl-1.b4.ext.1092 > dev.akcl-1.b1.int.49413: Flags [.], ack 1469355, win 8421, options [nop,nop,TS val 4116295627 ecr 2055394531], length 0
19:52:15.348770 IP dev.akcl-1.b4.ext.1092 > dev.akcl-1.b1.int.49413: Flags [.], ack 1534515, win 9439, options [nop,nop,TS val 4116295627 ecr 2055394531], length 0
19:52:15.348770 IP dev.akcl-1.b4.ext.1092 > dev.akcl-1.b1.int.49413: Flags [.], ack 1599675, win 10457, options [nop,nop,TS val 4116295627 ecr 2055394531], length 0
19:52:15.348770 IP dev.akcl-1.b4.ext.1092 > dev.akcl-1.b1.int.49413: Flags [.], ack 1657595, win 11362, options [nop,nop,TS val 4116295627 ecr 2055394531], length 0
19:52:15.348770 IP dev.akcl-1.b4.ext.1092 > dev.akcl-1.b1.int.49413: Flags [.], ack 1709378, win 12172, options [nop,nop,TS val 4116295627 ecr 2055394531], length 0
19:52:15.349393 IP dev.akcl-1.b4.ext.1092 > dev.akcl-1.b1.int.49413: Flags [P.], seq 8381:8494, ack 1709378, win 12172, options [nop,nop,TS val 4116295628 ecr 2055394531], length 113
19:52:15.354537 IP dev.akcl-1.b4.ext.1092 > dev.akcl-1.b1.int.49413: Flags [.], ack 1774538, win 13190, options [nop,nop,TS val 4116295633 ecr 2055394537], length 0
19:52:15.354746 IP dev.akcl-1.b4.ext.1092 > dev.akcl-1.b1.int.49413: Flags [.], ack 1839698, win 14208, options [nop,nop,TS val 4116295633 ecr 2055394537], length 0
19:52:15.354926 IP dev.akcl-1.b4.ext.1092 > dev.akcl-1.b1.int.49413: Flags [.], ack 1904858, win 15226, options [nop,nop,TS val 4116295633 ecr 2055394537], length 0
19:52:15.354926 IP dev.akcl-1.b4.ext.1092 > dev.akcl-1.b1.int.49413: Flags [.], ack 1970018, win 16244, options [nop,nop,TS val 4116295633 ecr 2055394537], length 0
19:52:15.355043 IP dev.akcl-1.b4.ext.1092 > dev.akcl-1.b1.int.49413: Flags [.], ack 2035178, win 17262, options [nop,nop,TS val 4116295633 ecr 2055394537], length 0
19:52:15.355043 IP dev.akcl-1.b4.ext.1092 > dev.akcl-1.b1.int.49413: Flags [.], ack 2046762, win 17443, options [nop,nop,TS val 4116295633 ecr 2055394537], length 0
19:52:15.355127 IP dev.akcl-1.b4.ext.1092 > dev.akcl-1.b1.int.49413: Flags [.], ack 2111922, win 18461, options [nop,nop,TS val 4116295633 ecr 2055394537], length 0
19:52:15.355151 IP dev.akcl-1.b4.ext.1092 > dev.akcl-1.b1.int.49413: Flags [.], ack 2177082, win 19479, options [nop,nop,TS val 4116295633 ecr 2055394537], length 0
19:52:15.355151 IP dev.akcl-1.b4.ext.1092 > dev.akcl-1.b1.int.49413: Flags [.], ack 2242242, win 20498, options [nop,nop,TS val 4116295633 ecr 2055394537], length 0
19:52:15.355325 IP dev.akcl-1.b4.ext.1092 > dev.akcl-1.b1.int.49413: Flags [.], ack 2307402, win 21516, options [nop,nop,TS val 4116295634 ecr 2055394537], length 0
19:52:15.355373 IP dev.akcl-1.b4.ext.1092 > dev.akcl-1.b1.int.49413: Flags [.], ack 2372562, win 22534, options [nop,nop,TS val 4116295634 ecr 2055394537], length 0
19:52:15.355381 IP dev.akcl-1.b4.ext.1092 > dev.akcl-1.b1.int.49413: Flags [.], ack 2437722, win 23552, options [nop,nop,TS val 4116295634 ecr 2055394538], length 0
19:52:15.355381 IP dev.akcl-1.b4.ext.1092 > dev.akcl-1.b1.int.49413: Flags [.], ack 2502882, win 24570, options [nop,nop,TS val 4116295634 ecr 2055394538], length 0
19:52:15.355381 IP dev.akcl-1.b4.ext.1092 > dev.akcl-1.b1.int.49413: Flags [.], ack 2568042, win 25588, options [nop,nop,TS val 4116295634 ecr 2055394538], length 0
19:52:15.355381 IP dev.akcl-1.b4.ext.1092 > dev.akcl-1.b1.int.49413: Flags [.], ack 2633202, win 26606, options [nop,nop,TS val 4116295634 ecr 2055394538], length 0
19:52:15.355381 IP dev.akcl-1.b4.ext.1092 > dev.akcl-1.b1.int.49413: Flags [.], ack 2648421, win 26844, options [nop,nop,TS val 4116295634 ecr 2055394538], length 0
19:52:15.356495 IP dev.akcl-1.b4.ext.1092 > dev.akcl-1.b1.int.49413: Flags [P.], seq 8494:8607, ack 2648421, win 26844, options [nop,nop,TS val 4116295635 ecr 2055394538], length 113
19:52:15.374524 IP dev.akcl-1.b4.ext.1092 > dev.akcl-1.b1.int.49413: Flags [.], ack 2713581, win 27862, options [nop,nop,TS val 4116295653 ecr 2055394557], length 0
19:52:15.374752 IP dev.akcl-1.b4.ext.1092 > dev.akcl-1.b1.int.49413: Flags [.], ack 2778741, win 28880, options [nop,nop,TS val 4116295653 ecr 2055394557], length 0
19:52:15.374835 IP dev.akcl-1.b4.ext.1092 > dev.akcl-1.b1.int.49413: Flags [.], ack 2843901, win 29898, options [nop,nop,TS val 4116295653 ecr 2055394557], length 0
19:52:15.374858 IP dev.akcl-1.b4.ext.1092 > dev.akcl-1.b1.int.49413: Flags [.], ack 2909061, win 30917, options [nop,nop,TS val 4116295653 ecr 2055394557], length 0
19:52:15.374858 IP dev.akcl-1.b4.ext.1092 > dev.akcl-1.b1.int.49413: Flags [.], ack 2974221, win 31935, options [nop,nop,TS val 4116295653 ecr 2055394557], length 0
19:52:15.374858 IP dev.akcl-1.b4.ext.1092 > dev.akcl-1.b1.int.49413: Flags [.], ack 3032141, win 32840, options [nop,nop,TS val 4116295653 ecr 2055394557], length 0
19:52:15.374858 IP dev.akcl-1.b4.ext.1092 > dev.akcl-1.b1.int.49413: Flags [.], ack 3097301, win 33858, options [nop,nop,TS val 4116295653 ecr 2055394557], length 0
19:52:15.374858 IP dev.akcl-1.b4.ext.1092 > dev.akcl-1.b1.int.49413: Flags [.], ack 3101645, win 33858, options [nop,nop,TS val 4116295653 ecr 2055394557], length 0
19:52:15.374858 IP dev.akcl-1.b4.ext.1092 > dev.akcl-1.b1.int.49413: Flags [.], ack 3162461, win 34808, options [nop,nop,TS val 4116295653 ecr 2055394557], length 0
19:52:15.374858 IP dev.akcl-1.b4.ext.1092 > dev.akcl-1.b1.int.49413: Flags [.], ack 3198680, win 35374, options [nop,nop,TS val 4116295653 ecr 2055394557], length 0
19:52:15.375531 IP dev.akcl-1.b4.ext.1092 > dev.akcl-1.b1.int.49413: Flags [P.], seq 8607:8720, ack 3198680, win 35374, options [nop,nop,TS val 4116295654 ecr 2055394557], length 113
19:52:15.383750 IP dev.akcl-1.b4.ext.1092 > dev.akcl-1.b1.int.49413: Flags [.], ack 3243334, win 35754, options [nop,nop,TS val 4116295662 ecr 2055394566], length 0
19:52:15.384214 IP dev.akcl-1.b4.ext.1092 > dev.akcl-1.b1.int.49413: Flags [P.], seq 8720:8833, ack 3243334, win 35754, options [nop,nop,TS val 4116295663 ecr 2055394566], length 113
19:52:15.389439 IP dev.akcl-1.b4.ext.1092 > dev.akcl-1.b1.int.49413: Flags [.], ack 3438814, win 34713, options [nop,nop,TS val 4116295668 ecr 2055394572], length 0
19:52:15.389533 IP dev.akcl-1.b4.ext.1092 > dev.akcl-1.b1.int.49413: Flags [.], ack 3488563, win 35713, options [nop,nop,TS val 4116295668 ecr 2055394572], length 0
19:52:15.389986 IP dev.akcl-1.b4.ext.1092 > dev.akcl-1.b1.int.49413: Flags [P.], seq 8833:8946, ack 3488563, win 35754, options [nop,nop,TS val 4116295669 ecr 2055394572], length 113
19:52:15.397423 IP dev.akcl-1.b4.ext.1092 > dev.akcl-1.b1.int.49413: Flags [.], ack 3553723, win 35596, options [nop,nop,TS val 4116295676 ecr 2055394580], length 0
19:52:15.397472 IP dev.akcl-1.b4.ext.1092 > dev.akcl-1.b1.int.49413: Flags [.], ack 3618883, win 35754, options [nop,nop,TS val 4116295676 ecr 2055394580], length 0
19:52:15.397472 IP dev.akcl-1.b4.ext.1092 > dev.akcl-1.b1.int.49413: Flags [.], ack 3684043, win 35596, options [nop,nop,TS val 4116295676 ecr 2055394580], length 0
19:52:15.397622 IP dev.akcl-1.b4.ext.1092 > dev.akcl-1.b1.int.49413: Flags [.], ack 3749203, win 35754, options [nop,nop,TS val 4116295676 ecr 2055394580], length 0
19:52:15.397736 IP dev.akcl-1.b4.ext.1092 > dev.akcl-1.b1.int.49413: Flags [.], ack 3814363, win 35754, options [nop,nop,TS val 4116295676 ecr 2055394580], length 0
19:52:15.397809 IP dev.akcl-1.b4.ext.1092 > dev.akcl-1.b1.int.49413: Flags [.], ack 3899795, win 35754, options [nop,nop,TS val 4116295676 ecr 2055394580], length 0
19:52:15.397838 IP dev.akcl-1.b4.ext.1092 > dev.akcl-1.b1.int.49413: Flags [.], ack 3964955, win 35596, options [nop,nop,TS val 4116295676 ecr 2055394580], length 0
19:52:15.397925 IP dev.akcl-1.b4.ext.1092 > dev.akcl-1.b1.int.49413: Flags [.], ack 4030115, win 35754, options [nop,nop,TS val 4116295676 ecr 2055394580], length 0
19:52:15.398003 IP dev.akcl-1.b4.ext.1092 > dev.akcl-1.b1.int.49413: Flags [.], ack 4095275, win 35754, options [nop,nop,TS val 4116295676 ecr 2055394580], length 0
19:52:15.398028 IP dev.akcl-1.b4.ext.1092 > dev.akcl-1.b1.int.49413: Flags [.], ack 4160435, win 35596, options [nop,nop,TS val 4116295676 ecr 2055394580], length 0
19:52:15.398076 IP dev.akcl-1.b4.ext.1092 > dev.akcl-1.b1.int.49413: Flags [.], ack 4225595, win 35754, options [nop,nop,TS val 4116295676 ecr 2055394580], length 0
19:52:15.398076 IP dev.akcl-1.b4.ext.1092 > dev.akcl-1.b1.int.49413: Flags [.], ack 4290755, win 35754, options [nop,nop,TS val 4116295676 ecr 2055394580], length 0
19:52:15.398076 IP dev.akcl-1.b4.ext.1092 > dev.akcl-1.b1.int.49413: Flags [.], ack 4355915, win 35754, options [nop,nop,TS val 4116295676 ecr 2055394580], length 0
19:52:15.398076 IP dev.akcl-1.b4.ext.1092 > dev.akcl-1.b1.int.49413: Flags [.], ack 4421075, win 35596, options [nop,nop,TS val 4116295677 ecr 2055394580], length 0
19:52:15.398076 IP dev.akcl-1.b4.ext.1092 > dev.akcl-1.b1.int.49413: Flags [.], ack 4486235, win 35754, options [nop,nop,TS val 4116295677 ecr 2055394580], length 0
19:52:15.398164 IP dev.akcl-1.b4.ext.1092 > dev.akcl-1.b1.int.49413: Flags [.], ack 4537210, win 35754, options [nop,nop,TS val 4116295677 ecr 2055394580], length 0
19:52:15.399243 IP dev.akcl-1.b4.ext.1092 > dev.akcl-1.b1.int.49413: Flags [P.], seq 8946:9059, ack 4537210, win 35754, options [nop,nop,TS val 4116295678 ecr 2055394580], length 113
19:52:15.460749 IP dev.akcl-1.b4.ext.1092 > dev.akcl-1.b1.int.49413: Flags [.], ack 4602370, win 35754, options [nop,nop,TS val 4116295739 ecr 2055394643], length 0
19:52:15.460906 IP dev.akcl-1.b4.ext.1092 > dev.akcl-1.b1.int.49413: Flags [.], ack 4667530, win 35754, options [nop,nop,TS val 4116295739 ecr 2055394643], length 0
19:52:15.460906 IP dev.akcl-1.b4.ext.1092 > dev.akcl-1.b1.int.49413: Flags [.], ack 4732690, win 35596, options [nop,nop,TS val 4116295739 ecr 2055394643], length 0
19:52:15.460999 IP dev.akcl-1.b4.ext.1092 > dev.akcl-1.b1.int.49413: Flags [.], ack 4797850, win 35754, options [nop,nop,TS val 4116295739 ecr 2055394643], length 0
19:52:15.461115 IP dev.akcl-1.b4.ext.1092 > dev.akcl-1.b1.int.49413: Flags [.], ack 4863010, win 35754, options [nop,nop,TS val 4116295739 ecr 2055394643], length 0
19:52:15.461246 IP dev.akcl-1.b4.ext.1092 > dev.akcl-1.b1.int.49413: Flags [.], ack 4928170, win 35596, options [nop,nop,TS val 4116295739 ecr 2055394643], length 0
19:52:15.461489 IP dev.akcl-1.b4.ext.1092 > dev.akcl-1.b1.int.49413: Flags [.], ack 4993330, win 35754, options [nop,nop,TS val 4116295739 ecr 2055394643], length 0
19:52:15.461690 IP dev.akcl-1.b4.ext.1092 > dev.akcl-1.b1.int.49413: Flags [.], ack 5002018, win 35889, options [nop,nop,TS val 4116295739 ecr 2055394643], length 0
19:52:15.461803 IP dev.akcl-1.b4.ext.1092 > dev.akcl-1.b1.int.49413: Flags [.], ack 5067178, win 35889, options [nop,nop,TS val 4116295740 ecr 2055394643], length 0
19:52:15.461893 IP dev.akcl-1.b4.ext.1092 > dev.akcl-1.b1.int.49413: Flags [.], ack 5070074, win 35889, options [nop,nop,TS val 4116295740 ecr 2055394643], length 0
19:52:15.461913 IP dev.akcl-1.b4.ext.1092 > dev.akcl-1.b1.int.49413: Flags [.], ack 5132338, win 35889, options [nop,nop,TS val 4116295740 ecr 2055394643], length 0
19:52:15.461913 IP dev.akcl-1.b4.ext.1092 > dev.akcl-1.b1.int.49413: Flags [.], ack 5197498, win 35596, options [nop,nop,TS val 4116295740 ecr 2055394643], length 0
19:52:15.461913 IP dev.akcl-1.b4.ext.1092 > dev.akcl-1.b1.int.49413: Flags [.], ack 5262658, win 35889, options [nop,nop,TS val 4116295740 ecr 2055394643], length 0
19:52:15.461913 IP dev.akcl-1.b4.ext.1092 > dev.akcl-1.b1.int.49413: Flags [.], ack 5327818, win 35889, options [nop,nop,TS val 4116295740 ecr 2055394644], length 0
19:52:15.462248 IP dev.akcl-1.b4.ext.1092 > dev.akcl-1.b1.int.49413: Flags [.], ack 5392978, win 35889, options [nop,nop,TS val 4116295740 ecr 2055394644], length 0
19:52:15.462478 IP dev.akcl-1.b4.ext.1092 > dev.akcl-1.b1.int.49413: Flags [.], ack 5403873, win 35889, options [nop,nop,TS val 4116295740 ecr 2055394644], length 0
19:52:15.462820 IP dev.akcl-1.b4.ext.1092 > dev.akcl-1.b1.int.49413: Flags [P.], seq 9059:9172, ack 5403873, win 35889, options [nop,nop,TS val 4116295741 ecr 2055394644], length 113
19:52:15.467290 IP dev.akcl-1.b4.ext.1092 > dev.akcl-1.b1.int.49413: Flags [.], ack 5469033, win 35596, options [nop,nop,TS val 4116295746 ecr 2055394650], length 0
19:52:15.467407 IP dev.akcl-1.b4.ext.1092 > dev.akcl-1.b1.int.49413: Flags [.], ack 5534193, win 35596, options [nop,nop,TS val 4116295746 ecr 2055394650], length 0
19:52:15.467582 IP dev.akcl-1.b4.ext.1092 > dev.akcl-1.b1.int.49413: Flags [.], ack 5599353, win 35596, options [nop,nop,TS val 4116295746 ecr 2055394650], length 0
19:52:15.467730 IP dev.akcl-1.b4.ext.1092 > dev.akcl-1.b1.int.49413: Flags [.], ack 5664513, win 35889, options [nop,nop,TS val 4116295746 ecr 2055394650], length 0
19:52:15.467769 IP dev.akcl-1.b4.ext.1092 > dev.akcl-1.b1.int.49413: Flags [.], ack 5729673, win 35889, options [nop,nop,TS val 4116295746 ecr 2055394650], length 0
19:52:15.467769 IP dev.akcl-1.b4.ext.1092 > dev.akcl-1.b1.int.49413: Flags [.], ack 5794833, win 35889, options [nop,nop,TS val 4116295746 ecr 2055394650], length 0
19:52:15.467769 IP dev.akcl-1.b4.ext.1092 > dev.akcl-1.b1.int.49413: Flags [.], ack 5859993, win 35889, options [nop,nop,TS val 4116295746 ecr 2055394650], length 0
19:52:15.467769 IP dev.akcl-1.b4.ext.1092 > dev.akcl-1.b1.int.49413: Flags [.], ack 5912121, win 35889, options [nop,nop,TS val 4116295746 ecr 2055394650], length 0
19:52:15.467769 IP dev.akcl-1.b4.ext.1092 > dev.akcl-1.b1.int.49413: Flags [.], ack 5977281, win 35596, options [nop,nop,TS val 4116295746 ecr 2055394650], length 0
19:52:15.467769 IP dev.akcl-1.b4.ext.1092 > dev.akcl-1.b1.int.49413: Flags [.], ack 6042441, win 35889, options [nop,nop,TS val 4116295746 ecr 2055394650], length 0
19:52:15.467769 IP dev.akcl-1.b4.ext.1092 > dev.akcl-1.b1.int.49413: Flags [.], ack 6107601, win 35889, options [nop,nop,TS val 4116295746 ecr 2055394650], length 0
19:52:15.467769 IP dev.akcl-1.b4.ext.1092 > dev.akcl-1.b1.int.49413: Flags [.], ack 6121640, win 35889, options [nop,nop,TS val 4116295746 ecr 2055394650], length 0
19:52:15.468524 IP dev.akcl-1.b4.ext.1092 > dev.akcl-1.b1.int.49413: Flags [P.], seq 9172:9285, ack 6121640, win 35889, options [nop,nop,TS val 4116295747 ecr 2055394650], length 113
19:52:15.512797 IP dev.akcl-1.b4.ext.1092 > dev.akcl-1.b1.int.49413: Flags [.], ack 6186800, win 35596, options [nop,nop,TS val 4116295791 ecr 2055394695], length 0
19:52:15.512959 IP dev.akcl-1.b4.ext.1092 > dev.akcl-1.b1.int.49413: Flags [.], ack 6251960, win 35596, options [nop,nop,TS val 4116295791 ecr 2055394695], length 0
19:52:15.513069 IP dev.akcl-1.b4.ext.1092 > dev.akcl-1.b1.int.49413: Flags [.], ack 6317120, win 35596, options [nop,nop,TS val 4116295791 ecr 2055394695], length 0
19:52:15.513107 IP dev.akcl-1.b4.ext.1092 > dev.akcl-1.b1.int.49413: Flags [.], ack 6382280, win 35889, options [nop,nop,TS val 4116295791 ecr 2055394695], length 0
19:52:15.513383 IP dev.akcl-1.b4.ext.1092 > dev.akcl-1.b1.int.49413: Flags [.], ack 6447440, win 35889, options [nop,nop,TS val 4116295791 ecr 2055394695], length 0
19:52:15.513464 IP dev.akcl-1.b4.ext.1092 > dev.akcl-1.b1.int.49413: Flags [.], ack 6512600, win 35596, options [nop,nop,TS val 4116295792 ecr 2055394695], length 0
19:52:15.513533 IP dev.akcl-1.b4.ext.1092 > dev.akcl-1.b1.int.49413: Flags [.], ack 6577760, win 35889, options [nop,nop,TS val 4116295792 ecr 2055394695], length 0
19:52:15.513551 IP dev.akcl-1.b4.ext.1092 > dev.akcl-1.b1.int.49413: Flags [.], ack 6642920, win 35889, options [nop,nop,TS val 4116295792 ecr 2055394695], length 0
19:52:15.513551 IP dev.akcl-1.b4.ext.1092 > dev.akcl-1.b1.int.49413: Flags [.], ack 6664640, win 35889, options [nop,nop,TS val 4116295792 ecr 2055394695], length 0
19:52:15.513552 IP dev.akcl-1.b4.ext.1092 > dev.akcl-1.b1.int.49413: Flags [.], ack 6729800, win 35889, options [nop,nop,TS val 4116295792 ecr 2055394696], length 0
19:52:15.513552 IP dev.akcl-1.b4.ext.1092 > dev.akcl-1.b1.int.49413: Flags [.], ack 6794960, win 35596, options [nop,nop,TS val 4116295792 ecr 2055394696], length 0
19:52:15.513552 IP dev.akcl-1.b4.ext.1092 > dev.akcl-1.b1.int.49413: Flags [.], ack 6860120, win 35889, options [nop,nop,TS val 4116295792 ecr 2055394696], length 0
19:52:15.513552 IP dev.akcl-1.b4.ext.1092 > dev.akcl-1.b1.int.49413: Flags [.], ack 6870256, win 36018, options [nop,nop,TS val 4116295792 ecr 2055394696], length 0
19:52:15.513552 IP dev.akcl-1.b4.ext.1092 > dev.akcl-1.b1.int.49413: Flags [.], ack 6925280, win 36018, options [nop,nop,TS val 4116295792 ecr 2055394696], length 0
19:52:15.513552 IP dev.akcl-1.b4.ext.1092 > dev.akcl-1.b1.int.49413: Flags [.], ack 6990440, win 36018, options [nop,nop,TS val 4116295792 ecr 2055394696], length 0
19:52:15.513561 IP dev.akcl-1.b4.ext.1092 > dev.akcl-1.b1.int.49413: Flags [.], ack 7055600, win 35770, options [nop,nop,TS val 4116295792 ecr 2055394696], length 0
19:52:15.513561 IP dev.akcl-1.b4.ext.1092 > dev.akcl-1.b1.int.49413: Flags [.], ack 7097907, win 36018, options [nop,nop,TS val 4116295792 ecr 2055394696], length 0
19:52:15.514664 IP dev.akcl-1.b4.ext.1092 > dev.akcl-1.b1.int.49413: Flags [P.], seq 9285:9398, ack 7097907, win 36018, options [nop,nop,TS val 4116295793 ecr 2055394696], length 113
19:52:15.526237 IP dev.akcl-1.b4.ext.1092 > dev.akcl-1.b1.int.49413: Flags [.], ack 7163067, win 36018, options [nop,nop,TS val 4116295805 ecr 2055394709], length 0
19:52:15.526431 IP dev.akcl-1.b4.ext.1092 > dev.akcl-1.b1.int.49413: Flags [.], ack 7228227, win 36018, options [nop,nop,TS val 4116295805 ecr 2055394709], length 0
19:52:15.526431 IP dev.akcl-1.b4.ext.1092 > dev.akcl-1.b1.int.49413: Flags [.], ack 7293387, win 35596, options [nop,nop,TS val 4116295805 ecr 2055394709], length 0
19:52:15.526431 IP dev.akcl-1.b4.ext.1092 > dev.akcl-1.b1.int.49413: Flags [.], ack 7358547, win 36018, options [nop,nop,TS val 4116295805 ecr 2055394709], length 0
19:52:15.526431 IP dev.akcl-1.b4.ext.1092 > dev.akcl-1.b1.int.49413: Flags [.], ack 7423707, win 36018, options [nop,nop,TS val 4116295805 ecr 2055394709], length 0
19:52:15.526431 IP dev.akcl-1.b4.ext.1092 > dev.akcl-1.b1.int.49413: Flags [.], ack 7488867, win 35596, options [nop,nop,TS val 4116295805 ecr 2055394709], length 0
19:52:15.526431 IP dev.akcl-1.b4.ext.1092 > dev.akcl-1.b1.int.49413: Flags [.], ack 7554027, win 36018, options [nop,nop,TS val 4116295805 ecr 2055394709], length 0
19:52:15.526431 IP dev.akcl-1.b4.ext.1092 > dev.akcl-1.b1.int.49413: Flags [.], ack 7639894, win 35936, options [nop,nop,TS val 4116295805 ecr 2055394709], length 0
19:52:15.527122 IP dev.akcl-1.b4.ext.1092 > dev.akcl-1.b1.int.49413: Flags [P.], seq 9398:9511, ack 7639894, win 36018, options [nop,nop,TS val 4116295806 ecr 2055394709], length 113
19:52:15.541574 IP dev.akcl-1.b4.ext.1092 > dev.akcl-1.b1.int.49413: Flags [.], ack 7683334, win 36018, options [nop,nop,TS val 4116295820 ecr 2055394724], length 0
19:52:15.541794 IP dev.akcl-1.b4.ext.1092 > dev.akcl-1.b1.int.49413: Flags [.], ack 7705054, win 35849, options [nop,nop,TS val 4116295820 ecr 2055394724], length 0
19:52:15.542199 IP dev.akcl-1.b4.ext.1092 > dev.akcl-1.b1.int.49413: Flags [.], ack 7965694, win 35596, options [nop,nop,TS val 4116295820 ecr 2055394724], length 0
19:52:15.542466 IP dev.akcl-1.b4.ext.1092 > dev.akcl-1.b1.int.49413: Flags [.], ack 8161174, win 36018, options [nop,nop,TS val 4116295821 ecr 2055394724], length 0
19:52:15.542620 IP dev.akcl-1.b4.ext.1092 > dev.akcl-1.b1.int.49413: Flags [.], ack 8688541, win 36018, options [nop,nop,TS val 4116295821 ecr 2055394725], length 0
19:52:15.543735 IP dev.akcl-1.b4.ext.1092 > dev.akcl-1.b1.int.49413: Flags [P.], seq 9511:9624, ack 8688541, win 36018, options [nop,nop,TS val 4116295822 ecr 2055394725], length 113
19:52:15.548205 IP dev.akcl-1.b4.ext.1092 > dev.akcl-1.b1.int.49413: Flags [.], ack 9144661, win 33096, options [nop,nop,TS val 4116295827 ecr 2055394730], length 0
19:52:15.548481 IP dev.akcl-1.b4.ext.1092 > dev.akcl-1.b1.int.49413: Flags [.], ack 9209821, win 33151, options [nop,nop,TS val 4116295827 ecr 2055394730], length 0
19:52:15.548712 IP dev.akcl-1.b4.ext.1092 > dev.akcl-1.b1.int.49413: Flags [.], ack 9332901, win 33651, options [nop,nop,TS val 4116295827 ecr 2055394730], length 0
19:52:15.548712 IP dev.akcl-1.b4.ext.1092 > dev.akcl-1.b1.int.49413: Flags [.], ack 9398061, win 34151, options [nop,nop,TS val 4116295827 ecr 2055394731], length 0
19:52:15.548712 IP dev.akcl-1.b4.ext.1092 > dev.akcl-1.b1.int.49413: Flags [.], ack 9463221, win 34596, options [nop,nop,TS val 4116295827 ecr 2055394731], length 0
19:52:15.548712 IP dev.akcl-1.b4.ext.1092 > dev.akcl-1.b1.int.49413: Flags [.], ack 9593541, win 35096, options [nop,nop,TS val 4116295827 ecr 2055394731], length 0
19:52:15.548712 IP dev.akcl-1.b4.ext.1092 > dev.akcl-1.b1.int.49413: Flags [.], ack 9658701, win 34991, options [nop,nop,TS val 4116295827 ecr 2055394731], length 0
19:52:15.548730 IP dev.akcl-1.b4.ext.1092 > dev.akcl-1.b1.int.49413: Flags [.], ack 9737188, win 35991, options [nop,nop,TS val 4116295827 ecr 2055394731], length 0
19:52:15.549935 IP dev.akcl-1.b4.ext.1092 > dev.akcl-1.b1.int.49413: Flags [P.], seq 9624:9737, ack 9737188, win 36018, options [nop,nop,TS val 4116295829 ecr 2055394731], length 113
19:52:15.562333 IP dev.akcl-1.b4.ext.1092 > dev.akcl-1.b1.int.49413: Flags [.], ack 9802348, win 36018, options [nop,nop,TS val 4116295841 ecr 2055394745], length 0
19:52:15.562689 IP dev.akcl-1.b4.ext.1092 > dev.akcl-1.b1.int.49413: Flags [.], ack 9867508, win 36018, options [nop,nop,TS val 4116295841 ecr 2055394745], length 0
19:52:15.562689 IP dev.akcl-1.b4.ext.1092 > dev.akcl-1.b1.int.49413: Flags [.], ack 9932668, win 35596, options [nop,nop,TS val 4116295841 ecr 2055394745], length 0
19:52:15.562798 IP dev.akcl-1.b4.ext.1092 > dev.akcl-1.b1.int.49413: Flags [.], ack 9997828, win 36018, options [nop,nop,TS val 4116295841 ecr 2055394745], length 0
19:52:15.562904 IP dev.akcl-1.b4.ext.1092 > dev.akcl-1.b1.int.49413: Flags [.], ack 10062988, win 36018, options [nop,nop,TS val 4116295841 ecr 2055394745], length 0
19:52:15.562904 IP dev.akcl-1.b4.ext.1092 > dev.akcl-1.b1.int.49413: Flags [.], ack 10128148, win 35596, options [nop,nop,TS val 4116295841 ecr 2055394745], length 0
19:52:15.562992 IP dev.akcl-1.b4.ext.1092 > dev.akcl-1.b1.int.49413: Flags [.], ack 10193308, win 36018, options [nop,nop,TS val 4116295841 ecr 2055394745], length 0
19:52:15.563094 IP dev.akcl-1.b4.ext.1092 > dev.akcl-1.b1.int.49413: Flags [.], ack 10258468, win 36018, options [nop,nop,TS val 4116295841 ecr 2055394745], length 0
19:52:15.564241 IP dev.akcl-1.b4.ext.1092 > dev.akcl-1.b1.int.49413: Flags [P.], seq 9737:9850, ack 10785835, win 36018, options [nop,nop,TS val 4116295843 ecr 2055394745], length 113
19:52:15.584125 IP dev.akcl-1.b4.ext.1092 > dev.akcl-1.b1.int.49413: Flags [.], ack 11111635, win 35509, options [nop,nop,TS val 4116295862 ecr 2055394766], length 0
19:52:15.586200 IP dev.akcl-1.b4.ext.1092 > dev.akcl-1.b1.int.49413: Flags [P.], seq 9850:9963, ack 11190300, win 36018, options [nop,nop,TS val 4116295865 ecr 2055394766], length 113
19:52:15.586913 IP dev.akcl-1.b4.ext.1092 > dev.akcl-1.b1.int.49413: Flags [.], ack 11255460, win 36018, options [nop,nop,TS val 4116295865 ecr 2055394769], length 0
19:52:15.586932 IP dev.akcl-1.b4.ext.1092 > dev.akcl-1.b1.int.49413: Flags [.], ack 11320620, win 36018, options [nop,nop,TS val 4116295865 ecr 2055394769], length 0
19:52:15.586932 IP dev.akcl-1.b4.ext.1092 > dev.akcl-1.b1.int.49413: Flags [.], ack 11385780, win 35760, options [nop,nop,TS val 4116295866 ecr 2055394769], length 0
19:52:15.587016 IP dev.akcl-1.b4.ext.1092 > dev.akcl-1.b1.int.49413: Flags [.], ack 11429325, win 36018, options [nop,nop,TS val 4116295866 ecr 2055394769], length 0
19:52:15.587418 IP dev.akcl-1.b4.ext.1092 > dev.akcl-1.b1.int.49413: Flags [P.], seq 9963:10076, ack 11429325, win 36018, options [nop,nop,TS val 4116295866 ecr 2055394769], length 113
19:52:15.590505 IP dev.akcl-1.b4.ext.1092 > dev.akcl-1.b1.int.49413: Flags [.], ack 11494485, win 36018, options [nop,nop,TS val 4116295869 ecr 2055394773], length 0
19:52:15.590543 IP dev.akcl-1.b4.ext.1092 > dev.akcl-1.b1.int.49413: Flags [.], ack 11559645, win 35680, options [nop,nop,TS val 4116295869 ecr 2055394773], length 0
19:52:15.590543 IP dev.akcl-1.b4.ext.1092 > dev.akcl-1.b1.int.49413: Flags [.], ack 11613548, win 36018, options [nop,nop,TS val 4116295869 ecr 2055394773], length 0
19:52:15.590768 IP dev.akcl-1.b4.ext.1092 > dev.akcl-1.b1.int.49413: Flags [P.], seq 10076:10189, ack 11613548, win 36018, options [nop,nop,TS val 4116295869 ecr 2055394773], length 113
19:52:15.592789 IP dev.akcl-1.b4.ext.1092 > dev.akcl-1.b1.int.49413: Flags [.], ack 11623684, win 36018, options [nop,nop,TS val 4116295871 ecr 2055394775], length 0
19:52:15.593298 IP dev.akcl-1.b4.ext.1092 > dev.akcl-1.b1.int.49413: Flags [.], ack 11678708, win 36018, options [nop,nop,TS val 4116295871 ecr 2055394775], length 0
19:52:15.593501 IP dev.akcl-1.b4.ext.1092 > dev.akcl-1.b1.int.49413: Flags [.], ack 11874188, win 36018, options [nop,nop,TS val 4116295872 ecr 2055394775], length 0
19:52:15.593687 IP dev.akcl-1.b4.ext.1092 > dev.akcl-1.b1.int.49413: Flags [.], ack 12004508, win 35596, options [nop,nop,TS val 4116295872 ecr 2055394775], length 0
19:52:15.593687 IP dev.akcl-1.b4.ext.1092 > dev.akcl-1.b1.int.49413: Flags [.], ack 12069668, win 36018, options [nop,nop,TS val 4116295872 ecr 2055394775], length 0
19:52:15.593863 IP dev.akcl-1.b4.ext.1092 > dev.akcl-1.b1.int.49413: Flags [.], ack 12624252, win 35803, options [nop,nop,TS val 4116295872 ecr 2055394776], length 0
19:52:15.593963 IP dev.akcl-1.b4.ext.1092 > dev.akcl-1.b1.int.49413: Flags [.], ack 12662195, win 36018, options [nop,nop,TS val 4116295873 ecr 2055394776], length 0
19:52:15.602034 IP dev.akcl-1.b4.ext.1092 > dev.akcl-1.b1.int.49413: Flags [.], ack 12727355, win 36018, options [nop,nop,TS val 4116295880 ecr 2055394784], length 0
19:52:15.602341 IP dev.akcl-1.b4.ext.1092 > dev.akcl-1.b1.int.49413: Flags [.], ack 12792515, win 36018, options [nop,nop,TS val 4116295880 ecr 2055394784], length 0
19:52:15.602468 IP dev.akcl-1.b4.ext.1092 > dev.akcl-1.b1.int.49413: Flags [.], ack 12922835, win 36018, options [nop,nop,TS val 4116295880 ecr 2055394784], length 0
19:52:15.602737 IP dev.akcl-1.b4.ext.1092 > dev.akcl-1.b1.int.49413: Flags [.], ack 12987995, win 36018, options [nop,nop,TS val 4116295881 ecr 2055394784], length 0
19:52:15.602737 IP dev.akcl-1.b4.ext.1092 > dev.akcl-1.b1.int.49413: Flags [.], ack 13053155, win 35596, options [nop,nop,TS val 4116295881 ecr 2055394784], length 0
19:52:15.602737 IP dev.akcl-1.b4.ext.1092 > dev.akcl-1.b1.int.49413: Flags [.], ack 13118315, win 36018, options [nop,nop,TS val 4116295881 ecr 2055394784], length 0
19:52:15.602737 IP dev.akcl-1.b4.ext.1092 > dev.akcl-1.b1.int.49413: Flags [.], ack 13183475, win 36018, options [nop,nop,TS val 4116295881 ecr 2055394784], length 0
19:52:15.602737 IP dev.akcl-1.b4.ext.1092 > dev.akcl-1.b1.int.49413: Flags [.], ack 13248635, win 36018, options [nop,nop,TS val 4116295881 ecr 2055394784], length 0
