19:53:20.138950 IP dev.akcl-1.b4.ext.1092 > dev.akcl-1.b1.int.62720: Flags [S.], seq 697969602, ack 3401757514, win 65160, options [mss 1460,sackOK,TS val 4116360418 ecr 2055459321,nop,wscale 7], length 0
19:53:20.149519 IP dev.akcl-1.b4.ext.1092 > dev.akcl-1.b1.int.62720: Flags [.], ack 102, win 509, options [nop,nop,TS val 4116360428 ecr 2055459332], length 0
19:53:20.160006 IP dev.akcl-1.b4.ext.1092 > dev.akcl-1.b1.int.62720: Flags [P.], seq 1:79, ack 102, win 509, options [nop,nop,TS val 4116360439 ecr 2055459332], length 78
19:53:20.444697 IP dev.akcl-1.b4.ext.1092 > dev.akcl-1.b1.int.62720: Flags [P.], seq 79:451, ack 318, win 508, options [nop,nop,TS val 4116360723 ecr 2055459626], length 372
19:53:20.746548 IP dev.akcl-1.b4.ext.1092 > dev.akcl-1.b1.int.62720: Flags [P.], seq 823:1195, ack 750, win 506, options [nop,nop,TS val 4116361025 ecr 2055459929], length 372
19:53:20.897007 IP dev.akcl-1.b4.ext.1092 > dev.akcl-1.b1.int.62720: Flags [P.], seq 1195:1567, ack 966, win 505, options [nop,nop,TS val 4116361176 ecr 2055460079], length 372
19:53:21.047396 IP dev.akcl-1.b4.ext.1092 > dev.akcl-1.b1.int.62720: Flags [P.], seq 1567:1939, ack 1182, win 504, options [nop,nop,TS val 4116361326 ecr 2055460229], length 372
19:53:21.219180 IP dev.akcl-1.b4.ext.1092 > dev.akcl-1.b1.int.62720: Flags [.], ack 8750, win 614, options [nop,nop,TS val 4116361498 ecr 2055460401], length 0
19:53:21.219180 IP dev.akcl-1.b4.ext.1092 > dev.akcl-1.b1.int.62720: Flags [.], ack 15990, win 641, options [nop,nop,TS val 4116361498 ecr 2055460401], length 0
19:53:21.219334 IP dev.akcl-1.b4.ext.1092 > dev.akcl-1.b1.int.62720: Flags [.], ack 30470, win 529, options [nop,nop,TS val 4116361498 ecr 2055460401], length 0
19:53:21.219334 IP dev.akcl-1.b4.ext.1092 > dev.akcl-1.b1.int.62720: Flags [.], ack 44950, win 419, options [nop,nop,TS val 4116361498 ecr 2055460401], length 0
19:53:21.219350 IP dev.akcl-1.b4.ext.1092 > dev.akcl-1.b1.int.62720: Flags [.], ack 47846, win 686, options [nop,nop,TS val 4116361498 ecr 2055460401], length 0
19:53:21.219371 IP dev.akcl-1.b4.ext.1092 > dev.akcl-1.b1.int.62720: Flags [.], ack 73910, win 686, options [nop,nop,TS val 4116361498 ecr 2055460401], length 0
19:53:21.219445 IP dev.akcl-1.b4.ext.1092 > dev.akcl-1.b1.int.62720: Flags [.], ack 79702, win 707, options [nop,nop,TS val 4116361498 ecr 2055460402], length 0
19:53:21.219489 IP dev.akcl-1.b4.ext.1092 > dev.akcl-1.b1.int.62720: Flags [.], ack 107270, win 537, options [nop,nop,TS val 4116361498 ecr 2055460402], length 0
19:53:21.219498 IP dev.akcl-1.b4.ext.1092 > dev.akcl-1.b1.int.62720: Flags [.], ack 111558, win 718, options [nop,nop,TS val 4116361498 ecr 2055460402], length 0
19:53:21.219498 IP dev.akcl-1.b4.ext.1092 > dev.akcl-1.b1.int.62720: Flags [.], ack 143414, win 470, options [nop,nop,TS val 4116361498 ecr 2055460402], length 0
19:53:21.219498 IP dev.akcl-1.b4.ext.1092 > dev.akcl-1.b1.int.62720: Flags [.], ack 175270, win 718, options [nop,nop,TS val 4116361498 ecr 2055460402], length 0
19:53:21.219663 IP dev.akcl-1.b4.ext.1092 > dev.akcl-1.b1.int.62720: Flags [.], ack 220158, win 1420, options [nop,nop,TS val 4116361498 ecr 2055460402], length 0
19:53:21.219721 IP dev.akcl-1.b4.ext.1092 > dev.akcl-1.b1.int.62720: Flags [.], ack 265046, win 2121, options [nop,nop,TS val 4116361498 ecr 2055460402], length 0
19:53:21.219721 IP dev.akcl-1.b4.ext.1092 > dev.akcl-1.b1.int.62720: Flags [.], ack 267174, win 2154, options [nop,nop,TS val 4116361498 ecr 2055460402], length 0
19:53:21.219872 IP dev.akcl-1.b4.ext.1092 > dev.akcl-1.b1.int.62720: Flags [.], ack 312062, win 2856, options [nop,nop,TS val 4116361498 ecr 2055460402], length 0
19:53:21.219940 IP dev.akcl-1.b4.ext.1092 > dev.akcl-1.b1.int.62720: Flags [.], ack 356950, win 3557, options [nop,nop,TS val 4116361498 ecr 2055460402], length 0
19:53:21.219940 IP dev.akcl-1.b4.ext.1092 > dev.akcl-1.b1.int.62720: Flags [.], ack 401838, win 4258, options [nop,nop,TS val 4116361498 ecr 2055460402], length 0
19:53:21.219940 IP dev.akcl-1.b4.ext.1092 > dev.akcl-1.b1.int.62720: Flags [.], ack 446726, win 4960, options [nop,nop,TS val 4116361498 ecr 2055460402], length 0
19:53:21.220170 IP dev.akcl-1.b4.ext.1092 > dev.akcl-1.b1.int.62720: Flags [.], ack 511886, win 5978, options [nop,nop,TS val 4116361499 ecr 2055460402], length 0
19:53:21.220314 IP dev.akcl-1.b4.ext.1092 > dev.akcl-1.b1.int.62720: Flags [.], ack 577046, win 6996, options [nop,nop,TS val 4116361499 ecr 2055460402], length 0
19:53:21.220427 IP dev.akcl-1.b4.ext.1092 > dev.akcl-1.b1.int.62720: Flags [.], ack 636414, win 7924, options [nop,nop,TS val 4116361499 ecr 2055460402], length 0
19:53:21.220440 IP dev.akcl-1.b4.ext.1092 > dev.akcl-1.b1.int.62720: Flags [.], ack 701574, win 8942, options [nop,nop,TS val 4116361499 ecr 2055460402], length 0
19:53:21.220560 IP dev.akcl-1.b4.ext.1092 > dev.akcl-1.b1.int.62720: Flags [.], ack 730534, win 9394, options [nop,nop,TS val 4116361499 ecr 2055460402], length 0
19:53:21.220560 IP dev.akcl-1.b4.ext.1092 > dev.akcl-1.b1.int.62720: Flags [.], ack 766734, win 9960, options [nop,nop,TS val 4116361499 ecr 2055460402], length 0
19:53:21.220584 IP dev.akcl-1.b4.ext.1092 > dev.akcl-1.b1.int.62720: Flags [.], ack 798590, win 10458, options [nop,nop,TS val 4116361499 ecr 2055460402], length 0
19:53:21.220603 IP dev.akcl-1.b4.ext.1092 > dev.akcl-1.b1.int.62720: Flags [.], ack 831894, win 10978, options [nop,nop,TS val 4116361499 ecr 2055460402], length 0
19:53:21.220603 IP dev.akcl-1.b4.ext.1092 > dev.akcl-1.b1.int.62720: Flags [.], ack 866646, win 11521, options [nop,nop,TS val 4116361499 ecr 2055460402], length 0
19:53:21.220603 IP dev.akcl-1.b4.ext.1092 > dev.akcl-1.b1.int.62720: Flags [.], ack 897054, win 11996, options [nop,nop,TS val 4116361499 ecr 2055460402], length 0
19:53:21.220603 IP dev.akcl-1.b4.ext.1092 > dev.akcl-1.b1.int.62720: Flags [.], ack 928910, win 12494, options [nop,nop,TS val 4116361499 ecr 2055460402], length 0
19:53:21.220603 IP dev.akcl-1.b4.ext.1092 > dev.akcl-1.b1.int.62720: Flags [.], ack 962214, win 13014, options [nop,nop,TS val 4116361499 ecr 2055460402], length 0
19:53:21.220603 IP dev.akcl-1.b4.ext.1092 > dev.akcl-1.b1.int.62720: Flags [.], ack 996966, win 13557, options [nop,nop,TS val 4116361499 ecr 2055460402], length 0
19:53:21.220603 IP dev.akcl-1.b4.ext.1092 > dev.akcl-1.b1.int.62720: Flags [.], ack 1027374, win 14032, options [nop,nop,TS val 4116361499 ecr 2055460402], length 0
19:53:21.220603 IP dev.akcl-1.b4.ext.1092 > dev.akcl-1.b1.int.62720: Flags [.], ack 1050157, win 14388, options [nop,nop,TS val 4116361499 ecr 2055460403], length 0
19:53:21.221550 IP dev.akcl-1.b4.ext.1092 > dev.akcl-1.b1.int.62720: Flags [P.], seq 2052:2165, ack 1050157, win 14388, options [nop,nop,TS val 4116361500 ecr 2055460403], length 113
19:53:21.253709 IP dev.akcl-1.b4.ext.1092 > dev.akcl-1.b1.int.62720: Flags [.], ack 1115317, win 15407, options [nop,nop,TS val 4116361532 ecr 2055460436], length 0
19:53:21.253790 IP dev.akcl-1.b4.ext.1092 > dev.akcl-1.b1.int.62720: Flags [.], ack 1180477, win 16425, options [nop,nop,TS val 4116361532 ecr 2055460436], length 0
19:53:21.253790 IP dev.akcl-1.b4.ext.1092 > dev.akcl-1.b1.int.62720: Flags [.], ack 1245637, win 17443, options [nop,nop,TS val 4116361532 ecr 2055460436], length 0
19:53:21.253790 IP dev.akcl-1.b4.ext.1092 > dev.akcl-1.b1.int.62720: Flags [.], ack 1310797, win 18461, options [nop,nop,TS val 4116361532 ecr 2055460436], length 0
19:53:21.253790 IP dev.akcl-1.b4.ext.1092 > dev.akcl-1.b1.int.62720: Flags [.], ack 1362925, win 19275, options [nop,nop,TS val 4116361532 ecr 2055460436], length 0
19:53:21.254679 IP dev.akcl-1.b4.ext.1092 > dev.akcl-1.b1.int.62720: Flags [.], ack 1428085, win 20294, options [nop,nop,TS val 4116361533 ecr 2055460437], length 0
19:53:21.254983 IP dev.akcl-1.b4.ext.1092 > dev.akcl-1.b1.int.62720: Flags [.], ack 1493245, win 21312, options [nop,nop,TS val 4116361533 ecr 2055460437], length 0
19:53:21.255053 IP dev.akcl-1.b4.ext.1092 > dev.akcl-1.b1.int.62720: Flags [.], ack 1558405, win 22330, options [nop,nop,TS val 4116361533 ecr 2055460437], length 0
19:53:21.255098 IP dev.akcl-1.b4.ext.1092 > dev.akcl-1.b1.int.62720: Flags [.], ack 1623565, win 23348, options [nop,nop,TS val 4116361533 ecr 2055460437], length 0
19:53:21.255179 IP dev.akcl-1.b4.ext.1092 > dev.akcl-1.b1.int.62720: Flags [.], ack 1688725, win 24366, options [nop,nop,TS val 4116361533 ecr 2055460437], length 0
19:53:21.255179 IP dev.akcl-1.b4.ext.1092 > dev.akcl-1.b1.int.62720: Flags [.], ack 1691621, win 24366, options [nop,nop,TS val 4116361533 ecr 2055460437], length 0
19:53:21.255272 IP dev.akcl-1.b4.ext.1092 > dev.akcl-1.b1.int.62720: Flags [.], ack 1753885, win 25339, options [nop,nop,TS val 4116361534 ecr 2055460437], length 0
19:53:21.255303 IP dev.akcl-1.b4.ext.1092 > dev.akcl-1.b1.int.62720: Flags [.], ack 1761125, win 25452, options [nop,nop,TS val 4116361534 ecr 2055460437], length 0
19:53:21.255303 IP dev.akcl-1.b4.ext.1092 > dev.akcl-1.b1.int.62720: Flags [.], ack 1819045, win 26357, options [nop,nop,TS val 4116361534 ecr 2055460437], length 0
19:53:21.255321 IP dev.akcl-1.b4.ext.1092 > dev.akcl-1.b1.int.62720: Flags [.], ack 1829181, win 26515, options [nop,nop,TS val 4116361534 ecr 2055460437], length 0
19:53:21.255321 IP dev.akcl-1.b4.ext.1092 > dev.akcl-1.b1.int.62720: Flags [.], ack 1884205, win 27375, options [nop,nop,TS val 4116361534 ecr 2055460437], length 0
19:53:21.255321 IP dev.akcl-1.b4.ext.1092 > dev.akcl-1.b1.int.62720: Flags [.], ack 1949365, win 28393, options [nop,nop,TS val 4116361534 ecr 2055460437], length 0
19:53:21.255321 IP dev.akcl-1.b4.ext.1092 > dev.akcl-1.b1.int.62720: Flags [.], ack 2014525, win 29411, options [nop,nop,TS val 4116361534 ecr 2055460437], length 0
19:53:21.255321 IP dev.akcl-1.b4.ext.1092 > dev.akcl-1.b1.int.62720: Flags [.], ack 2079685, win 30430, options [nop,nop,TS val 4116361534 ecr 2055460437], length 0
19:53:21.255321 IP dev.akcl-1.b4.ext.1092 > dev.akcl-1.b1.int.62720: Flags [.], ack 2098804, win 30728, options [nop,nop,TS val 4116361534 ecr 2055460437], length 0
19:53:21.256045 IP dev.akcl-1.b4.ext.1092 > dev.akcl-1.b1.int.62720: Flags [P.], seq 2165:2278, ack 2098804, win 30728, options [nop,nop,TS val 4116361535 ecr 2055460437], length 113
19:53:21.259340 IP dev.akcl-1.b4.ext.1092 > dev.akcl-1.b1.int.62720: Flags [.], ack 2163964, win 31746, options [nop,nop,TS val 4116361538 ecr 2055460441], length 0
19:53:21.259497 IP dev.akcl-1.b4.ext.1092 > dev.akcl-1.b1.int.62720: Flags [.], ack 2229124, win 32765, options [nop,nop,TS val 4116361538 ecr 2055460441], length 0
19:53:21.259668 IP dev.akcl-1.b4.ext.1092 > dev.akcl-1.b1.int.62720: Flags [.], ack 2294284, win 33783, options [nop,nop,TS val 4116361538 ecr 2055460441], length 0
19:53:21.259668 IP dev.akcl-1.b4.ext.1092 > dev.akcl-1.b1.int.62720: Flags [.], ack 2359444, win 34801, options [nop,nop,TS val 4116361538 ecr 2055460441], length 0
19:53:21.259773 IP dev.akcl-1.b4.ext.1092 > dev.akcl-1.b1.int.62720: Flags [.], ack 2424604, win 35596, options [nop,nop,TS val 4116361538 ecr 2055460441], length 0
19:53:21.259863 IP dev.akcl-1.b4.ext.1092 > dev.akcl-1.b1.int.62720: Flags [.], ack 2465148, win 35596, options [nop,nop,TS val 4116361538 ecr 2055460441], length 0
19:53:21.259864 IP dev.akcl-1.b4.ext.1092 > dev.akcl-1.b1.int.62720: Flags [.], ack 2530308, win 35596, options [nop,nop,TS val 4116361538 ecr 2055460441], length 0
19:53:21.259944 IP dev.akcl-1.b4.ext.1092 > dev.akcl-1.b1.int.62720: Flags [.], ack 2595468, win 35596, options [nop,nop,TS val 4116361538 ecr 2055460441], length 0
19:53:21.260016 IP dev.akcl-1.b4.ext.1092 > dev.akcl-1.b1.int.62720: Flags [.], ack 2601260, win 35596, options [nop,nop,TS val 4116361538 ecr 2055460441], length 0
19:53:21.260046 IP dev.akcl-1.b4.ext.1092 > dev.akcl-1.b1.int.62720: Flags [.], ack 2660628, win 35640, options [nop,nop,TS val 4116361538 ecr 2055460442], length 0
19:53:21.260130 IP dev.akcl-1.b4.ext.1092 > dev.akcl-1.b1.int.62720: Flags [.], ack 2725788, win 35596, options [nop,nop,TS val 4116361538 ecr 2055460442], length 0
19:53:21.260183 IP dev.akcl-1.b4.ext.1092 > dev.akcl-1.b1.int.62720: Flags [.], ack 2790948, win 35596, options [nop,nop,TS val 4116361538 ecr 2055460442], length 0
19:53:21.260202 IP dev.akcl-1.b4.ext.1092 > dev.akcl-1.b1.int.62720: Flags [.], ack 2856108, win 35596, options [nop,nop,TS val 4116361538 ecr 2055460442], length 0
19:53:21.260202 IP dev.akcl-1.b4.ext.1092 > dev.akcl-1.b1.int.62720: Flags [.], ack 2921268, win 35640, options [nop,nop,TS val 4116361539 ecr 2055460442], length 0
19:53:21.260202 IP dev.akcl-1.b4.ext.1092 > dev.akcl-1.b1.int.62720: Flags [.], ack 2986428, win 35640, options [nop,nop,TS val 4116361539 ecr 2055460442], length 0
19:53:21.260202 IP dev.akcl-1.b4.ext.1092 > dev.akcl-1.b1.int.62720: Flags [.], ack 3051588, win 35596, options [nop,nop,TS val 4116361539 ecr 2055460442], length 0
19:53:21.260202 IP dev.akcl-1.b4.ext.1092 > dev.akcl-1.b1.int.62720: Flags [.], ack 3116748, win 35640, options [nop,nop,TS val 4116361539 ecr 2055460442], length 0
19:53:21.260203 IP dev.akcl-1.b4.ext.1092 > dev.akcl-1.b1.int.62720: Flags [.], ack 3147451, win 35858, options [nop,nop,TS val 4116361539 ecr 2055460442], length 0
19:53:21.261185 IP dev.akcl-1.b4.ext.1092 > dev.akcl-1.b1.int.62720: Flags [P.], seq 2278:2391, ack 3147451, win 35858, options [nop,nop,TS val 4116361540 ecr 2055460442], length 113
19:53:21.264558 IP dev.akcl-1.b4.ext.1092 > dev.akcl-1.b1.int.62720: Flags [.], ack 3212611, win 35858, options [nop,nop,TS val 4116361543 ecr 2055460446], length 0
19:53:21.264558 IP dev.akcl-1.b4.ext.1092 > dev.akcl-1.b1.int.62720: Flags [.], ack 3277771, win 35858, options [nop,nop,TS val 4116361543 ecr 2055460446], length 0
19:53:21.264558 IP dev.akcl-1.b4.ext.1092 > dev.akcl-1.b1.int.62720: Flags [.], ack 3342931, win 35596, options [nop,nop,TS val 4116361543 ecr 2055460446], length 0
19:53:21.264718 IP dev.akcl-1.b4.ext.1092 > dev.akcl-1.b1.int.62720: Flags [.], ack 3408091, win 35858, options [nop,nop,TS val 4116361543 ecr 2055460446], length 0
19:53:21.264833 IP dev.akcl-1.b4.ext.1092 > dev.akcl-1.b1.int.62720: Flags [.], ack 3473251, win 35858, options [nop,nop,TS val 4116361543 ecr 2055460446], length 0
19:53:21.264916 IP dev.akcl-1.b4.ext.1092 > dev.akcl-1.b1.int.62720: Flags [.], ack 3538411, win 35858, options [nop,nop,TS val 4116361543 ecr 2055460446], length 0
19:53:21.264943 IP dev.akcl-1.b4.ext.1092 > dev.akcl-1.b1.int.62720: Flags [.], ack 3565923, win 35858, options [nop,nop,TS val 4116361543 ecr 2055460446], length 0
19:53:21.264943 IP dev.akcl-1.b4.ext.1092 > dev.akcl-1.b1.int.62720: Flags [.], ack 3631083, win 35596, options [nop,nop,TS val 4116361543 ecr 2055460447], length 0
19:53:21.265021 IP dev.akcl-1.b4.ext.1092 > dev.akcl-1.b1.int.62720: Flags [.], ack 3696243, win 35858, options [nop,nop,TS val 4116361543 ecr 2055460447], length 0
19:53:21.265105 IP dev.akcl-1.b4.ext.1092 > dev.akcl-1.b1.int.62720: Flags [.], ack 3761403, win 35858, options [nop,nop,TS val 4116361543 ecr 2055460447], length 0
19:53:21.265154 IP dev.akcl-1.b4.ext.1092 > dev.akcl-1.b1.int.62720: Flags [.], ack 3826563, win 35858, options [nop,nop,TS val 4116361543 ecr 2055460447], length 0
19:53:21.265173 IP dev.akcl-1.b4.ext.1092 > dev.akcl-1.b1.int.62720: Flags [.], ack 3891723, win 35596, options [nop,nop,TS val 4116361543 ecr 2055460447], length 0
19:53:21.265173 IP dev.akcl-1.b4.ext.1092 > dev.akcl-1.b1.int.62720: Flags [.], ack 3956883, win 35858, options [nop,nop,TS val 4116361544 ecr 2055460447], length 0
19:53:21.265173 IP dev.akcl-1.b4.ext.1092 > dev.akcl-1.b1.int.62720: Flags [.], ack 4022043, win 35858, options [nop,nop,TS val 4116361544 ecr 2055460447], length 0
19:53:21.265173 IP dev.akcl-1.b4.ext.1092 > dev.akcl-1.b1.int.62720: Flags [.], ack 4087203, win 35596, options [nop,nop,TS val 4116361544 ecr 2055460447], length 0
19:53:21.265173 IP dev.akcl-1.b4.ext.1092 > dev.akcl-1.b1.int.62720: Flags [.], ack 4152363, win 35858, options [nop,nop,TS val 4116361544 ecr 2055460447], length 0
19:53:21.265173 IP dev.akcl-1.b4.ext.1092 > dev.akcl-1.b1.int.62720: Flags [.], ack 4196076, win 35858, options [nop,nop,TS val 4116361544 ecr 2055460447], length 0
19:53:21.266364 IP dev.akcl-1.b4.ext.1092 > dev.akcl-1.b1.int.62720: Flags [P.], seq 2391:2504, ack 4196076, win 35858, options [nop,nop,TS val 4116361545 ecr 2055460447], length 113
19:53:21.327564 IP dev.akcl-1.b4.ext.1092 > dev.akcl-1.b1.int.62720: Flags [.], ack 4261236, win 35858, options [nop,nop,TS val 4116361606 ecr 2055460509], length 0
19:53:21.327751 IP dev.akcl-1.b4.ext.1092 > dev.akcl-1.b1.int.62720: Flags [.], ack 4326396, win 35858, options [nop,nop,TS val 4116361606 ecr 2055460509], length 0
19:53:21.327779 IP dev.akcl-1.b4.ext.1092 > dev.akcl-1.b1.int.62720: Flags [.], ack 4391556, win 35596, options [nop,nop,TS val 4116361606 ecr 2055460509], length 0
19:53:21.327862 IP dev.akcl-1.b4.ext.1092 > dev.akcl-1.b1.int.62720: Flags [.], ack 4456716, win 35858, options [nop,nop,TS val 4116361606 ecr 2055460510], length 0
19:53:21.327970 IP dev.akcl-1.b4.ext.1092 > dev.akcl-1.b1.int.62720: Flags [.], ack 4521876, win 35858, options [nop,nop,TS val 4116361606 ecr 2055460510], length 0
19:53:21.328061 IP dev.akcl-1.b4.ext.1092 > dev.akcl-1.b1.int.62720: Flags [.], ack 4587036, win 35596, options [nop,nop,TS val 4116361606 ecr 2055460510], length 0
19:53:21.328144 IP dev.akcl-1.b4.ext.1092 > dev.akcl-1.b1.int.62720: Flags [.], ack 4652196, win 35858, options [nop,nop,TS val 4116361606 ecr 2055460510], length 0
19:53:21.328231 IP dev.akcl-1.b4.ext.1092 > dev.akcl-1.b1.int.62720: Flags [.], ack 4666676, win 35985, options [nop,nop,TS val 4116361606 ecr 2055460510], length 0
19:53:21.328231 IP dev.akcl-1.b4.ext.1092 > dev.akcl-1.b1.int.62720: Flags [.], ack 4731836, win 35596, options [nop,nop,TS val 4116361606 ecr 2055460510], length 0
19:53:21.328231 IP dev.akcl-1.b4.ext.1092 > dev.akcl-1.b1.int.62720: Flags [.], ack 4796996, win 35596, options [nop,nop,TS val 4116361606 ecr 2055460510], length 0
19:53:21.328231 IP dev.akcl-1.b4.ext.1092 > dev.akcl-1.b1.int.62720: Flags [.], ack 4862156, win 35596, options [nop,nop,TS val 4116361606 ecr 2055460510], length 0
19:53:21.328258 IP dev.akcl-1.b4.ext.1092 > dev.akcl-1.b1.int.62720: Flags [.], ack 4927316, win 35985, options [nop,nop,TS val 4116361607 ecr 2055460510], length 0
19:53:21.328308 IP dev.akcl-1.b4.ext.1092 > dev.akcl-1.b1.int.62720: Flags [.], ack 4992476, win 35985, options [nop,nop,TS val 4116361607 ecr 2055460510], length 0
19:53:21.328308 IP dev.akcl-1.b4.ext.1092 > dev.akcl-1.b1.int.62720: Flags [.], ack 5122796, win 35596, options [nop,nop,TS val 4116361607 ecr 2055460510], length 0
19:53:21.328308 IP dev.akcl-1.b4.ext.1092 > dev.akcl-1.b1.int.62720: Flags [.], ack 5187956, win 35596, options [nop,nop,TS val 4116361607 ecr 2055460510], length 0
19:53:21.328308 IP dev.akcl-1.b4.ext.1092 > dev.akcl-1.b1.int.62720: Flags [.], ack 5244723, win 35658, options [nop,nop,TS val 4116361607 ecr 2055460510], length 0
19:53:21.329530 IP dev.akcl-1.b4.ext.1092 > dev.akcl-1.b1.int.62720: Flags [P.], seq 2504:2617, ack 5244723, win 35985, options [nop,nop,TS val 4116361608 ecr 2055460510], length 113
19:53:21.333588 IP dev.akcl-1.b4.ext.1092 > dev.akcl-1.b1.int.62720: Flags [.], ack 5309883, win 35985, options [nop,nop,TS val 4116361612 ecr 2055460515], length 0
19:53:21.333698 IP dev.akcl-1.b4.ext.1092 > dev.akcl-1.b1.int.62720: Flags [.], ack 5375043, win 35985, options [nop,nop,TS val 4116361612 ecr 2055460515], length 0
19:53:21.333777 IP dev.akcl-1.b4.ext.1092 > dev.akcl-1.b1.int.62720: Flags [.], ack 5440203, win 35596, options [nop,nop,TS val 4116361612 ecr 2055460515], length 0
19:53:21.333803 IP dev.akcl-1.b4.ext.1092 > dev.akcl-1.b1.int.62720: Flags [.], ack 5505363, win 35985, options [nop,nop,TS val 4116361612 ecr 2055460515], length 0
19:53:21.333891 IP dev.akcl-1.b4.ext.1092 > dev.akcl-1.b1.int.62720: Flags [.], ack 5570523, win 35985, options [nop,nop,TS val 4116361612 ecr 2055460515], length 0
19:53:21.333978 IP dev.akcl-1.b4.ext.1092 > dev.akcl-1.b1.int.62720: Flags [.], ack 5635683, win 35596, options [nop,nop,TS val 4116361612 ecr 2055460515], length 0
19:53:21.334003 IP dev.akcl-1.b4.ext.1092 > dev.akcl-1.b1.int.62720: Flags [.], ack 5700843, win 35985, options [nop,nop,TS val 4116361612 ecr 2055460515], length 0
19:53:21.334091 IP dev.akcl-1.b4.ext.1092 > dev.akcl-1.b1.int.62720: Flags [.], ack 5766003, win 35985, options [nop,nop,TS val 4116361612 ecr 2055460515], length 0
19:53:21.334144 IP dev.akcl-1.b4.ext.1092 > dev.akcl-1.b1.int.62720: Flags [.], ack 5832611, win 35985, options [nop,nop,TS val 4116361612 ecr 2055460515], length 0
19:53:21.334144 IP dev.akcl-1.b4.ext.1092 > dev.akcl-1.b1.int.62720: Flags [.], ack 5836955, win 35985, options [nop,nop,TS val 4116361612 ecr 2055460515], length 0
19:53:21.334144 IP dev.akcl-1.b4.ext.1092 > dev.akcl-1.b1.int.62720: Flags [.], ack 5897771, win 35629, options [nop,nop,TS val 4116361612 ecr 2055460516], length 0
19:53:21.334144 IP dev.akcl-1.b4.ext.1092 > dev.akcl-1.b1.int.62720: Flags [.], ack 5962931, win 35985, options [nop,nop,TS val 4116361612 ecr 2055460516], length 0
19:53:21.334150 IP dev.akcl-1.b4.ext.1092 > dev.akcl-1.b1.int.62720: Flags [.], ack 6028091, win 35985, options [nop,nop,TS val 4116361612 ecr 2055460516], length 0
19:53:21.334150 IP dev.akcl-1.b4.ext.1092 > dev.akcl-1.b1.int.62720: Flags [.], ack 6093251, win 35596, options [nop,nop,TS val 4116361613 ecr 2055460516], length 0
19:53:21.334150 IP dev.akcl-1.b4.ext.1092 > dev.akcl-1.b1.int.62720: Flags [.], ack 6158411, win 35985, options [nop,nop,TS val 4116361613 ecr 2055460516], length 0
19:53:21.334150 IP dev.akcl-1.b4.ext.1092 > dev.akcl-1.b1.int.62720: Flags [.], ack 6223571, win 35985, options [nop,nop,TS val 4116361613 ecr 2055460516], length 0
19:53:21.334150 IP dev.akcl-1.b4.ext.1092 > dev.akcl-1.b1.int.62720: Flags [.], ack 6293348, win 35985, options [nop,nop,TS val 4116361613 ecr 2055460516], length 0
19:53:21.335216 IP dev.akcl-1.b4.ext.1092 > dev.akcl-1.b1.int.62720: Flags [P.], seq 2617:2730, ack 6293348, win 35985, options [nop,nop,TS val 4116361614 ecr 2055460516], length 113
19:53:21.497841 IP dev.akcl-1.b4.ext.1092 > dev.akcl-1.b1.int.62720: Flags [P.], seq 2730:3169, ack 6293634, win 35985, options [nop,nop,TS val 4116361776 ecr 2055460680], length 439
19:53:21.539353 IP dev.akcl-1.b4.ext.1092 > dev.akcl-1.b1.int.62720: Flags [.], ack 6358794, win 35596, options [nop,nop,TS val 4116361818 ecr 2055460721], length 0
19:53:21.539590 IP dev.akcl-1.b4.ext.1092 > dev.akcl-1.b1.int.62720: Flags [.], ack 6423954, win 35985, options [nop,nop,TS val 4116361818 ecr 2055460721], length 0
19:53:21.539749 IP dev.akcl-1.b4.ext.1092 > dev.akcl-1.b1.int.62720: Flags [.], ack 6489114, win 35596, options [nop,nop,TS val 4116361818 ecr 2055460721], length 0
19:53:21.539937 IP dev.akcl-1.b4.ext.1092 > dev.akcl-1.b1.int.62720: Flags [.], ack 6554274, win 35985, options [nop,nop,TS val 4116361818 ecr 2055460721], length 0
19:53:21.540214 IP dev.akcl-1.b4.ext.1092 > dev.akcl-1.b1.int.62720: Flags [.], ack 7342281, win 33469, options [nop,nop,TS val 4116361819 ecr 2055460722], length 0
19:53:21.798386 IP dev.akcl-1.b4.ext.1092 > dev.akcl-1.b1.int.62720: Flags [P.], seq 3282:3721, ack 7342567, win 35985, options [nop,nop,TS val 4116362077 ecr 2055460980], length 439
19:53:21.948851 IP dev.akcl-1.b4.ext.1092 > dev.akcl-1.b1.int.62720: Flags [P.], seq 3721:4160, ack 7342853, win 35985, options [nop,nop,TS val 4116362227 ecr 2055461131], length 439
19:53:22.099356 IP dev.akcl-1.b4.ext.1092 > dev.akcl-1.b1.int.62720: Flags [P.], seq 4160:4599, ack 7343139, win 35985, options [nop,nop,TS val 4116362378 ecr 2055461281], length 439
19:53:22.180131 IP dev.akcl-1.b4.ext.1092 > dev.akcl-1.b1.int.62720: Flags [.], ack 7408299, win 35596, options [nop,nop,TS val 4116362458 ecr 2055461362], length 0
19:53:22.180131 IP dev.akcl-1.b4.ext.1092 > dev.akcl-1.b1.int.62720: Flags [.], ack 7473459, win 35596, options [nop,nop,TS val 4116362458 ecr 2055461362], length 0
19:53:22.180131 IP dev.akcl-1.b4.ext.1092 > dev.akcl-1.b1.int.62720: Flags [.], ack 7538619, win 35596, options [nop,nop,TS val 4116362459 ecr 2055461362], length 0
19:53:22.180131 IP dev.akcl-1.b4.ext.1092 > dev.akcl-1.b1.int.62720: Flags [.], ack 7603779, win 35985, options [nop,nop,TS val 4116362459 ecr 2055461362], length 0
19:53:22.180386 IP dev.akcl-1.b4.ext.1092 > dev.akcl-1.b1.int.62720: Flags [.], ack 7657355, win 35985, options [nop,nop,TS val 4116362459 ecr 2055461362], length 0
19:53:22.180640 IP dev.akcl-1.b4.ext.1092 > dev.akcl-1.b1.int.62720: Flags [.], ack 7722515, win 35596, options [nop,nop,TS val 4116362459 ecr 2055461362], length 0
19:53:22.180736 IP dev.akcl-1.b4.ext.1092 > dev.akcl-1.b1.int.62720: Flags [.], ack 7787675, win 35985, options [nop,nop,TS val 4116362459 ecr 2055461362], length 0
19:53:22.180760 IP dev.akcl-1.b4.ext.1092 > dev.akcl-1.b1.int.62720: Flags [.], ack 7852835, win 35985, options [nop,nop,TS val 4116362459 ecr 2055461362], length 0
19:53:22.180881 IP dev.akcl-1.b4.ext.1092 > dev.akcl-1.b1.int.62720: Flags [.], ack 8374115, win 35958, options [nop,nop,TS val 4116362459 ecr 2055461363], length 0
19:53:22.180935 IP dev.akcl-1.b4.ext.1092 > dev.akcl-1.b1.int.62720: Flags [.], ack 8391764, win 35985, options [nop,nop,TS val 4116362460 ecr 2055461363], length 0
19:53:22.181869 IP dev.akcl-1.b4.ext.1092 > dev.akcl-1.b1.int.62720: Flags [P.], seq 4599:4712, ack 8391764, win 35985, options [nop,nop,TS val 4116362460 ecr 2055461363], length 113
19:53:22.184316 IP dev.akcl-1.b4.ext.1092 > dev.akcl-1.b1.int.62720: Flags [.], ack 8907252, win 35985, options [nop,nop,TS val 4116362463 ecr 2055461366], length 0
19:53:22.185707 IP dev.akcl-1.b4.ext.1092 > dev.akcl-1.b1.int.62720: Flags [P.], seq 4712:4825, ack 9440411, win 35985, options [nop,nop,TS val 4116362464 ecr 2055461366], length 113
19:53:22.220345 IP dev.akcl-1.b4.ext.1092 > dev.akcl-1.b1.int.62720: Flags [.], ack 10489058, win 34903, options [nop,nop,TS val 4116362499 ecr 2055461402], length 0
19:53:22.221617 IP dev.akcl-1.b4.ext.1092 > dev.akcl-1.b1.int.62720: Flags [P.], seq 4825:4938, ack 10799728, win 35985, options [nop,nop,TS val 4116362500 ecr 2055461403], length 113
19:53:22.222577 IP dev.akcl-1.b4.ext.1092 > dev.akcl-1.b1.int.62720: Flags [P.], seq 4938:5051, ack 10799728, win 35985, options [nop,nop,TS val 4116362501 ecr 2055461403], length 113
19:53:22.349092 IP dev.akcl-1.b4.ext.1092 > dev.akcl-1.b1.int.62720: Flags [.], ack 13762687, win 35985, options [nop,nop,TS val 4116362627 ecr 2055461531], length 0
19:53:22.349220 IP dev.akcl-1.b4.ext.1092 > dev.akcl-1.b1.int.62720: Flags [.], ack 13827847, win 35596, options [nop,nop,TS val 4116362627 ecr 2055461531], length 0
19:53:22.350872 IP dev.akcl-1.b4.ext.1092 > dev.akcl-1.b1.int.62720: Flags [.], ack 14746174, win 35985, options [nop,nop,TS val 4116362629 ecr 2055461533], length 0
19:53:22.351179 IP dev.akcl-1.b4.ext.1092 > dev.akcl-1.b1.int.62720: Flags [.], ack 14811334, win 35985, options [nop,nop,TS val 4116362629 ecr 2055461533], length 0
19:53:22.351180 IP dev.akcl-1.b4.ext.1092 > dev.akcl-1.b1.int.62720: Flags [P.], seq 5390:5503, ack 14811334, win 35985, options [nop,nop,TS val 4116362629 ecr 2055461533], length 113
19:53:22.352530 IP dev.akcl-1.b4.ext.1092 > dev.akcl-1.b1.int.62720: Flags [P.], seq 5503:5616, ack 15729639, win 35985, options [nop,nop,TS val 4116362631 ecr 2055461533], length 113
19:53:22.550259 IP dev.akcl-1.b4.ext.1092 > dev.akcl-1.b1.int.62720: Flags [P.], seq 5616:6055, ack 15729925, win 35985, options [nop,nop,TS val 4116362829 ecr 2055461732], length 439
19:53:22.700787 IP dev.akcl-1.b4.ext.1092 > dev.akcl-1.b1.int.62720: Flags [P.], seq 6055:6494, ack 15730211, win 35985, options [nop,nop,TS val 4116362979 ecr 2055461883], length 439
19:53:22.885228 IP dev.akcl-1.b4.ext.1092 > dev.akcl-1.b1.int.62720: Flags [.], ack 15925977, win 35596, options [nop,nop,TS val 4116363163 ecr 2055462067], length 0
19:53:22.886968 IP dev.akcl-1.b4.ext.1092 > dev.akcl-1.b1.int.62720: Flags [P.], seq 6933:7046, ack 16779144, win 35985, options [nop,nop,TS val 4116363166 ecr 2055462067], length 113
19:53:22.903328 IP dev.akcl-1.b4.ext.1092 > dev.akcl-1.b1.int.62720: Flags [.], ack 16844304, win 35985, options [nop,nop,TS val 4116363182 ecr 2055462085], length 0
19:53:22.903650 IP dev.akcl-1.b4.ext.1092 > dev.akcl-1.b1.int.62720: Flags [.], ack 16909464, win 35985, options [nop,nop,TS val 4116363182 ecr 2055462085], length 0
19:53:22.903890 IP dev.akcl-1.b4.ext.1092 > dev.akcl-1.b1.int.62720: Flags [.], ack 16974624, win 35596, options [nop,nop,TS val 4116363182 ecr 2055462085], length 0
19:53:22.904005 IP dev.akcl-1.b4.ext.1092 > dev.akcl-1.b1.int.62720: Flags [.], ack 17039784, win 35985, options [nop,nop,TS val 4116363182 ecr 2055462085], length 0
19:53:22.904005 IP dev.akcl-1.b4.ext.1092 > dev.akcl-1.b1.int.62720: Flags [.], ack 17104944, win 35985, options [nop,nop,TS val 4116363182 ecr 2055462085], length 0
19:53:22.904005 IP dev.akcl-1.b4.ext.1092 > dev.akcl-1.b1.int.62720: Flags [.], ack 17170104, win 35596, options [nop,nop,TS val 4116363182 ecr 2055462085], length 0
19:53:22.904005 IP dev.akcl-1.b4.ext.1092 > dev.akcl-1.b1.int.62720: Flags [.], ack 17235264, win 35985, options [nop,nop,TS val 4116363182 ecr 2055462085], length 0
19:53:22.904005 IP dev.akcl-1.b4.ext.1092 > dev.akcl-1.b1.int.62720: Flags [.], ack 17300424, win 35985, options [nop,nop,TS val 4116363182 ecr 2055462085], length 0
19:53:22.904005 IP dev.akcl-1.b4.ext.1092 > dev.akcl-1.b1.int.62720: Flags [.], ack 17365584, win 35985, options [nop,nop,TS val 4116363182 ecr 2055462085], length 0
19:53:22.904006 IP dev.akcl-1.b4.ext.1092 > dev.akcl-1.b1.int.62720: Flags [.], ack 17430744, win 35596, options [nop,nop,TS val 4116363182 ecr 2055462085], length 0
19:53:22.904006 IP dev.akcl-1.b4.ext.1092 > dev.akcl-1.b1.int.62720: Flags [.], ack 17495904, win 35985, options [nop,nop,TS val 4116363182 ecr 2055462085], length 0
19:53:22.904011 IP dev.akcl-1.b4.ext.1092 > dev.akcl-1.b1.int.62720: Flags [.], ack 17561064, win 35985, options [nop,nop,TS val 4116363182 ecr 2055462085], length 0
19:53:22.904011 IP dev.akcl-1.b4.ext.1092 > dev.akcl-1.b1.int.62720: Flags [.], ack 17626224, win 35596, options [nop,nop,TS val 4116363182 ecr 2055462085], length 0
19:53:22.904011 IP dev.akcl-1.b4.ext.1092 > dev.akcl-1.b1.int.62720: Flags [.], ack 17698624, win 35985, options [nop,nop,TS val 4116363182 ecr 2055462085], length 0
19:53:22.904011 IP dev.akcl-1.b4.ext.1092 > dev.akcl-1.b1.int.62720: Flags [.], ack 17763784, win 35985, options [nop,nop,TS val 4116363183 ecr 2055462085], length 0
19:53:22.904109 IP dev.akcl-1.b4.ext.1092 > dev.akcl-1.b1.int.62720: Flags [.], ack 17827791, win 35985, options [nop,nop,TS val 4116363183 ecr 2055462085], length 0
19:53:22.905154 IP dev.akcl-1.b4.ext.1092 > dev.akcl-1.b1.int.62720: Flags [P.], seq 7046:7159, ack 17827791, win 35985, options [nop,nop,TS val 4116363184 ecr 2055462085], length 113
19:53:22.915463 IP dev.akcl-1.b4.ext.1092 > dev.akcl-1.b1.int.62720: Flags [.], ack 17892951, win 35985, options [nop,nop,TS val 4116363194 ecr 2055462097], length 0
19:53:22.915780 IP dev.akcl-1.b4.ext.1092 > dev.akcl-1.b1.int.62720: Flags [.], ack 17958111, win 35985, options [nop,nop,TS val 4116363194 ecr 2055462097], length 0
19:53:22.915984 IP dev.akcl-1.b4.ext.1092 > dev.akcl-1.b1.int.62720: Flags [.], ack 18023271, win 35596, options [nop,nop,TS val 4116363194 ecr 2055462097], length 0
19:53:22.916104 IP dev.akcl-1.b4.ext.1092 > dev.akcl-1.b1.int.62720: Flags [.], ack 18088431, win 35985, options [nop,nop,TS val 4116363194 ecr 2055462097], length 0
19:53:22.916162 IP dev.akcl-1.b4.ext.1092 > dev.akcl-1.b1.int.62720: Flags [.], ack 18153591, win 35985, options [nop,nop,TS val 4116363194 ecr 2055462097], length 0
19:53:22.916162 IP dev.akcl-1.b4.ext.1092 > dev.akcl-1.b1.int.62720: Flags [.], ack 18218751, win 35596, options [nop,nop,TS val 4116363194 ecr 2055462097], length 0
19:53:22.916162 IP dev.akcl-1.b4.ext.1092 > dev.akcl-1.b1.int.62720: Flags [.], ack 18283911, win 35985, options [nop,nop,TS val 4116363194 ecr 2055462097], length 0
19:53:22.916162 IP dev.akcl-1.b4.ext.1092 > dev.akcl-1.b1.int.62720: Flags [.], ack 18349071, win 35985, options [nop,nop,TS val 4116363194 ecr 2055462097], length 0
19:53:22.916163 IP dev.akcl-1.b4.ext.1092 > dev.akcl-1.b1.int.62720: Flags [.], ack 18414231, win 35985, options [nop,nop,TS val 4116363194 ecr 2055462097], length 0
19:53:22.916163 IP dev.akcl-1.b4.ext.1092 > dev.akcl-1.b1.int.62720: Flags [.], ack 18479391, win 35596, options [nop,nop,TS val 4116363194 ecr 2055462097], length 0
19:53:22.916163 IP dev.akcl-1.b4.ext.1092 > dev.akcl-1.b1.int.62720: Flags [.], ack 18544551, win 35985, options [nop,nop,TS val 4116363194 ecr 2055462097], length 0
19:53:22.916163 IP dev.akcl-1.b4.ext.1092 > dev.akcl-1.b1.int.62720: Flags [.], ack 18609711, win 35985, options [nop,nop,TS val 4116363194 ecr 2055462097], length 0
19:53:22.916168 IP dev.akcl-1.b4.ext.1092 > dev.akcl-1.b1.int.62720: Flags [.], ack 18674871, win 35596, options [nop,nop,TS val 4116363195 ecr 2055462097], length 0
19:53:22.916168 IP dev.akcl-1.b4.ext.1092 > dev.akcl-1.b1.int.62720: Flags [.], ack 18740031, win 35985, options [nop,nop,TS val 4116363195 ecr 2055462097], length 0
19:53:22.916168 IP dev.akcl-1.b4.ext.1092 > dev.akcl-1.b1.int.62720: Flags [.], ack 18799399, win 35985, options [nop,nop,TS val 4116363195 ecr 2055462098], length 0
19:53:22.916168 IP dev.akcl-1.b4.ext.1092 > dev.akcl-1.b1.int.62720: Flags [.], ack 18876438, win 35985, options [nop,nop,TS val 4116363195 ecr 2055462098], length 0
19:53:22.917238 IP dev.akcl-1.b4.ext.1092 > dev.akcl-1.b1.int.62720: Flags [P.], seq 7159:7272, ack 18876438, win 35985, options [nop,nop,TS val 4116363196 ecr 2055462098], length 113
19:53:23.151928 IP dev.akcl-1.b4.ext.1092 > dev.akcl-1.b1.int.62720: Flags [P.], seq 7272:7711, ack 18876724, win 35985, options [nop,nop,TS val 4116363431 ecr 2055462334], length 439
19:53:23.302345 IP dev.akcl-1.b4.ext.1092 > dev.akcl-1.b1.int.62720: Flags [P.], seq 7711:8150, ack 18877010, win 35985, options [nop,nop,TS val 4116363581 ecr 2055462484], length 439
19:53:23.452898 IP dev.akcl-1.b4.ext.1092 > dev.akcl-1.b1.int.62720: Flags [P.], seq 8150:8589, ack 18877296, win 35985, options [nop,nop,TS val 4116363731 ecr 2055462635], length 439
19:53:23.603459 IP dev.akcl-1.b4.ext.1092 > dev.akcl-1.b1.int.62720: Flags [P.], seq 8589:9028, ack 18877582, win 35985, options [nop,nop,TS val 4116363882 ecr 2055462785], length 439
19:53:23.904481 IP dev.akcl-1.b4.ext.1092 > dev.akcl-1.b1.int.62720: Flags [P.], seq 9467:9839, ack 18878084, win 35985, options [nop,nop,TS val 4116364183 ecr 2055463086], length 372
19:53:24.054996 IP dev.akcl-1.b4.ext.1092 > dev.akcl-1.b1.int.62720: Flags [P.], seq 9839:10211, ack 18878300, win 35985, options [nop,nop,TS val 4116364334 ecr 2055463237], length 372
19:53:24.205953 IP dev.akcl-1.b4.ext.1092 > dev.akcl-1.b1.int.62720: Flags [P.], seq 10211:10583, ack 18878516, win 35985, options [nop,nop,TS val 4116364485 ecr 2055463388], length 372
19:53:24.356445 IP dev.akcl-1.b4.ext.1092 > dev.akcl-1.b1.int.62720: Flags [P.], seq 10583:10955, ack 18878732, win 35985, options [nop,nop,TS val 4116364635 ecr 2055463538], length 372
19:53:24.653558 IP dev.akcl-1.b4.ext.1092 > dev.akcl-1.b1.int.62720: Flags [.], ack 19992755, win 35985, options [nop,nop,TS val 4116364932 ecr 2055463835], length 0
19:53:24.653771 IP dev.akcl-1.b4.ext.1092 > dev.akcl-1.b1.int.62720: Flags [.], ack 20057915, win 35985, options [nop,nop,TS val 4116364932 ecr 2055463835], length 0
19:53:24.654074 IP dev.akcl-1.b4.ext.1092 > dev.akcl-1.b1.int.62720: Flags [.], ack 20123075, win 35596, options [nop,nop,TS val 4116364932 ecr 2055463835], length 0
19:53:24.654166 IP dev.akcl-1.b4.ext.1092 > dev.akcl-1.b1.int.62720: Flags [.], ack 20188235, win 35985, options [nop,nop,TS val 4116364932 ecr 2055463835], length 0
19:53:24.654166 IP dev.akcl-1.b4.ext.1092 > dev.akcl-1.b1.int.62720: Flags [.], ack 20253395, win 35985, options [nop,nop,TS val 4116364932 ecr 2055463835], length 0
19:53:24.654166 IP dev.akcl-1.b4.ext.1092 > dev.akcl-1.b1.int.62720: Flags [.], ack 20318555, win 35596, options [nop,nop,TS val 4116364932 ecr 2055463835], length 0
19:53:24.654243 IP dev.akcl-1.b4.ext.1092 > dev.akcl-1.b1.int.62720: Flags [.], ack 20383715, win 35985, options [nop,nop,TS val 4116364932 ecr 2055463835], length 0
19:53:24.654243 IP dev.akcl-1.b4.ext.1092 > dev.akcl-1.b1.int.62720: Flags [.], ack 20448875, win 35985, options [nop,nop,TS val 4116364932 ecr 2055463835], length 0
19:53:24.654243 IP dev.akcl-1.b4.ext.1092 > dev.akcl-1.b1.int.62720: Flags [.], ack 20514035, win 35985, options [nop,nop,TS val 4116364932 ecr 2055463835], length 0
19:53:24.654243 IP dev.akcl-1.b4.ext.1092 > dev.akcl-1.b1.int.62720: Flags [.], ack 20644355, win 35596, options [nop,nop,TS val 4116364932 ecr 2055463835], length 0
19:53:24.654243 IP dev.akcl-1.b4.ext.1092 > dev.akcl-1.b1.int.62720: Flags [.], ack 20734131, win 35985, options [nop,nop,TS val 4116364933 ecr 2055463835], length 0
19:53:24.654243 IP dev.akcl-1.b4.ext.1092 > dev.akcl-1.b1.int.62720: Flags [.], ack 20799291, win 35985, options [nop,nop,TS val 4116364933 ecr 2055463836], length 0
19:53:24.654243 IP dev.akcl-1.b4.ext.1092 > dev.akcl-1.b1.int.62720: Flags [.], ack 20864451, win 35596, options [nop,nop,TS val 4116364933 ecr 2055463836], length 0
19:53:24.654243 IP dev.akcl-1.b4.ext.1092 > dev.akcl-1.b1.int.62720: Flags [.], ack 20929611, win 35985, options [nop,nop,TS val 4116364933 ecr 2055463836], length 0
19:53:24.654253 IP dev.akcl-1.b4.ext.1092 > dev.akcl-1.b1.int.62720: Flags [.], ack 20976242, win 35985, options [nop,nop,TS val 4116364933 ecr 2055463836], length 0
19:53:24.655026 IP dev.akcl-1.b4.ext.1092 > dev.akcl-1.b1.int.62720: Flags [P.], seq 11440:11553, ack 20976242, win 35985, options [nop,nop,TS val 4116364934 ecr 2055463836], length 113
19:53:24.658252 IP dev.akcl-1.b4.ext.1092 > dev.akcl-1.b1.int.62720: Flags [.], ack 21041402, win 35985, options [nop,nop,TS val 4116364937 ecr 2055463840], length 0
19:53:24.658533 IP dev.akcl-1.b4.ext.1092 > dev.akcl-1.b1.int.62720: Flags [.], ack 21106562, win 35985, options [nop,nop,TS val 4116364937 ecr 2055463840], length 0
19:53:24.658823 IP dev.akcl-1.b4.ext.1092 > dev.akcl-1.b1.int.62720: Flags [.], ack 21171722, win 35596, options [nop,nop,TS val 4116364937 ecr 2055463840], length 0
19:53:24.658937 IP dev.akcl-1.b4.ext.1092 > dev.akcl-1.b1.int.62720: Flags [.], ack 21236882, win 35985, options [nop,nop,TS val 4116364937 ecr 2055463840], length 0
19:53:24.658989 IP dev.akcl-1.b4.ext.1092 > dev.akcl-1.b1.int.62720: Flags [.], ack 21302042, win 35985, options [nop,nop,TS val 4116364937 ecr 2055463840], length 0
19:53:24.658989 IP dev.akcl-1.b4.ext.1092 > dev.akcl-1.b1.int.62720: Flags [.], ack 21367202, win 35596, options [nop,nop,TS val 4116364937 ecr 2055463840], length 0
19:53:24.658989 IP dev.akcl-1.b4.ext.1092 > dev.akcl-1.b1.int.62720: Flags [.], ack 21432362, win 35985, options [nop,nop,TS val 4116364937 ecr 2055463840], length 0
19:53:24.658989 IP dev.akcl-1.b4.ext.1092 > dev.akcl-1.b1.int.62720: Flags [.], ack 21497522, win 35985, options [nop,nop,TS val 4116364937 ecr 2055463840], length 0
19:53:24.658989 IP dev.akcl-1.b4.ext.1092 > dev.akcl-1.b1.int.62720: Flags [.], ack 21562682, win 35985, options [nop,nop,TS val 4116364937 ecr 2055463840], length 0
19:53:24.658989 IP dev.akcl-1.b4.ext.1092 > dev.akcl-1.b1.int.62720: Flags [.], ack 21627842, win 35596, options [nop,nop,TS val 4116364937 ecr 2055463840], length 0
19:53:24.658989 IP dev.akcl-1.b4.ext.1092 > dev.akcl-1.b1.int.62720: Flags [.], ack 21693002, win 35985, options [nop,nop,TS val 4116364937 ecr 2055463840], length 0
